Project name,BIS Shared Services,Business Bank Project,Further Education 24+ Learning Loans Programme,ICR Monetisation,Project Eagle (formerly Urenco Future Options),SLC Transformation Programme,The Francis Crick Institute (formerly UKCMRI),Electoral Registration Transformation Programme,National Citizen Service,National Cyber Security Programme,New Civil Service 2015 Pension Scheme Implementation,Next Generation Shared Services,ICT Procurement Programme,Enterprise Zones Programme,The Future of Local Audit,Broadband Delivery Programme,Mobile Infrastructure Project,The Tate Modern Project,Urban Broadband Fund - Super-Connected City Initiative,World Conservation and Exhibitions Centre,Carbon Capture & Storage Commercialisation Programme,Dounreay Parent Body Organisation (PBO) - Delivery Phase,Electricity Market Reform Programme,FID Enabling for Hinkley Point C,FID Enabling for Renewables,Geological Disposal Facility Programme (GDF),Household Energy Efficiency ,Magnox & RSRL PBO Competition,Renewable Heat Incentive,Smart Meters Implementation Programme,CAP Delivery Programme,Thames Estuary Programme Phase 1 (TEP1),Thames Tideway Tunnel,Building Schools for the Future (BSF),Priority School Building Programme - Private Finance,Priority School Building Programme - Capital,St Helena Airport,A14 Cambridge to Huntingdon Improvement Scheme,Crossrail,High Speed Rail Programme,Intercity Express Programme (IEP),Periodic Review 2013 (Rail Investment Strategy - HLOS & SOFA),Rail Franchising Programme,Search & Rescue Helicopters (SARH),Shared Services Implementation Programme,Thameslink,Better Care Fund,"Brighton & Sussex University Hospitals NHS Trust (3Ts Programme - The development of a leading teaching, trauma and tertiary care centre)",Broadmoor Redevelopment Programme,BT LSP (London),BT LSP (South),care.data,Care and Support Implementation Programme,Childhood Flu Immunisation Programme,CSC LSP Delivery Programme,Death Certification,E&N Herts NHS Trust - Lister Hospital ('Our Changing Hospitals' Phase 4 Programme),Electronic Prescription Service (EPS) Release 2,Francis & Compassionate Care programme,General Practice System of Choice (GPSoC) Replacement,Genomics Programme,Health Visitor Programme,Liaison and Diversion Programme,Mersey Care NHS LIFT scheme (TIME - To Improve Mental Health Environments),National Pandemic Flu Service,National Proton Beam Therapy (PBT) Service Development Programme,NHS Choices,NHS e-Referral Service,NHS Electronic Staff Record Reprocurement Project,NHS Pension Re-let Project,NHS Procurement Efficiency Programme,NHSmail2,North Tees & Hartlepool Foundation Trust - New Hospital Development,Nursing Technology Fund,Papworth Foundation Trust - New Papworth Hospital,PHE Science Hub,Pre-Pandemic Vaccine,Health and Social Care Network (Formerly Public Services Network for Health (PSNH)),Rotavirus Immunisation Programme,Royal Liverpool & Broadgreen ('World Class Hospitals; World Class Services - Renewing the Royal Liverpool University Hospital'),Royal National Orthopaedic Hospital (RNOH) NHS Trust PFI Project,Sandwell and West Birmingham Hospitals NHS Trust - The Midland Metropolitan Hospital Project,Shingles Immunisation Programme,South Acute Programme,Spine 2,Summary Care Record (SCR),SUS Transition,Automatic Enrolment Programme,Child Maintenance Group Change,Conditionality Package,Estates Programme,Fit for Work (previously called Health and Work Service),"Fraud, Error and Debt Programme",Help to Work Package,IT Transformation Programme,New State Pension Project,Personal Independence Payment Programme,Universal Credit,ABUJA: New Office and Residence,ICT Re-procurement,Overseas Healthcare Provision,UKERP,Debt Staff Reinvestment,Digital Solutions Portfolio,Expanding the use of Debt Collection Agencies,One Click,Organised Crime,Real Time Information (RTI),Tax-Free Childcare,Volume Crime,Equitable Life Payment Scheme,Adelphi Modernisation Project,Communications Capabilities Development Programme,Digital Services at the Border,Disclosure and Barring  Service (DBS) Programme,Emergency Services Mobile Communications Programme (ESMCP),Harmondsworth and Colnbrook Retender,Immigration Platform Technologies (IPT),Next Generation Outsourced Visa Services Contract,Technology Reset Programme (TRP),Schengen Information System (SIS II) Programme,Transforming the Customer Experience (Formerly A&E),A400M,Airseeker,Army 2020,Army Basing Programme,Astute Boats 1-7,BORONA,CEPP,CHINOOK (incl Project Julius),Complex Weapons,Core Production Capability,Corporate Services Systems Convergence Programme,Crowsnest Programme,Cryptographic Enabling  Services,Defence Core Network Services,Defence Information Infrastructure,Future Reserves 2020,Head Office and Customer Design,Lightning II Programme,Logistics Commodities Services Transformation,Maritime Sustainment Programme,MARSHALL,Merlin Programme,Mounted Close Combat,Next Generation Estates Contracts,New Employment Model,Nuclear Warhead Capability Sustainment Programme,Operating Model Rollout,Puma Helicopter Life Extension Programme,Queen Elizabeth Programme,Spearfish Upgrade Programme,Strategic Business Partner Implementation Programme,Submarine Enterprise Performance Programme,Successor SSBN,The Materiel Strategy,Type 26 Global Combat Ship Programme,Typhoon,Wildcat,WATCHKEEPER,Whole Fleet Management,Court Estates Reform,CJS Efficiency Programme Phase 2,Common Platform,Crime Change Programme,Electronic Monitoring,Future IT Sourcing Programme (FITS),HMCTS Compliance & Enforcement Services Project,HMCTS Reform,Integrated Delivery Programme,Legal Aid Reform Implementation,Legal Aid Transformation,MoJ Shared Services,New Wales Prison,NOMS ICTS Services (NIS) Programme (formally part of Quantum Re-compete Project),Prison Competitions Phase 2,Prison Unit Cost Programme,Rehabilitation Programme,Transforming Youth Custody,NCA Information and Communications Technology (ICT) Modernisation Programme (was SOCA ISOT),Novo Programme,YODA Project (Outsourced Services Retender Project),2011 Census,Beyond 2011,Consumer and Retail Prices Indices (CPI/RPI) Re-engineering,Electronic Data Collection,ESA10/BPM6 Programme (European Systems of Accounting 2010),Web Data Access (WDA) Project
Department,BIS,BIS,BIS,BIS,BIS,BIS,BIS,CO,CO,CO,CO,CO,CPS,DCLG,DCLG,DCMS,DCMS,DCMS,DCMS,DCMS,DECC,DECC,DECC,DECC,DECC,DECC,DECC,DECC,DECC,DECC,DEFRA,DEFRA,DEFRA,DfE,DfE,DfE,DfID,DfT,DfT,DfT,DfT,DfT,DfT,DfT,DfT,DfT,DoH Non Capital,DoH Capital,DoH Capital,DoH Non Capital,DoH Non Capital,DoH Non Capital,DoH Non Capital,DoH Non Capital,DoH Non Capital,DoH Non Capital,DoH Capital,DoH Non Capital,DoH Non Capital,DoH Non Capital,DoH Non Capital,DoH Non Capital,DoH Non Capital,DoH Capital,DoH Non Capital,DoH Non Capital,DoH Non Capital,DoH Non Capital,DoH Non Capital,DoH Non Capital,DoH Non Capital,DoH Non Capital,DoH Capital,DoH Non Capital,DoH Capital,DoH Capital,DoH Non Capital,DoH Non Capital,DoH Non Capital,DoH Capital,DoH Capital,DoH Capital,DoH Non Capital,DoH Non Capital,DoH Non Capital,DoH Non Capital,DoH Non Capital,DWP,DWP,DWP,DWP,DWP,DWP,DWP,DWP,DWP,DWP,DWP,FCO,FCO,FCO,FCO,HMRC,HMRC,HMRC,HMRC,HMRC,HMRC,HMRC,HMRC,HMT,HO,HO,HO,HO,HO,HO,HO,HO,HO,HO,HO,MoD,MoD,MoD,MoD,MoD,MoD,MoD,MoD,MoD,MoD,MoD,MoD,MoD,MoD,MoD,MoD,MoD,MoD,MoD,MoD,MoD,MoD,MoD,MoD,MoD,MoD,MoD,MoD,MoD,MoD,MoD,MoD,MoD,MoD,MoD,MoD,MoD,MoD,MoD,MoJ,MoJ,MoJ,MoJ,MoJ,MoJ,MoJ,MoJ,MoJ,MoJ,MoJ,MoJ,MoJ,MoJ,MoJ,MoJ,MoJ,MoJ,NCA,NCA,NS&I,ONS,ONS,ONS,ONS,ONS,ONS
"MPA RAG rating
(A Delivery Confidence Assessment of the project at a fixed point in time, using a five-point scale, Red – Amber/Red – Amber – Amber/Green – Green; definitions in the MPA Annual Report)",Amber,Amber/Green,Amber/Green,Amber,Amber/Red,Amber/Red,Amber/Green,Amber/Green,Amber/Green,Green,Amber,Amber/Red,Amber,Amber,Amber,Amber/Green,Amber/Red,Amber/Red,Amber,Green,Amber,Green,Amber,Data exempt under Section 43(2) of the Freedom of Information Act (2000),Amber,Amber,Amber/Red,Amber/Green,Amber,Amber,Amber/Red,Green,Amber/Red,Green,Amber/Red,Amber/Red,Amber/Green,Amber/Green,Amber/Green,Amber/Red,Amber/Green,Green,Amber,Amber/Green,Amber/Red,Amber,Amber/Red,Amber/Green,Green,Amber/Red,Amber/Red,Red,Amber/Red,Amber,Amber/Red,Red,Amber/Green,Amber,Amber/Red,Amber,Amber,Amber,Amber,Amber/Green,Red,Amber,Red,Amber,Amber/Green,Amber/Red,Amber/Red,Amber,Green,Amber,Amber/Green,Amber,Amber/Red,Red,Green,Green,Green,Amber/Green,Green,Amber/Green,Amber,Amber,Amber/Red,Amber,Amber/Green,Amber,Amber/Green,Amber,Amber,Amber,Amber/Red,Amber,Amber/Red,Amber/Red,Amber/Green,Amber/Red,Amber/Green,Amber/Green,Green,Amber,Green,Amber/Green,Amber/Green,Amber/Green,Amber/Red,Green,Green,Amber,Amber,Amber,Amber,Amber,Green,Amber,Green,Amber/Red,Amber/Red,Amber/Green,Amber/Green,Amber/Green,Amber,Red,Amber/Red,Amber/Green,Amber/Red,Amber/Green,Amber,Amber,Amber,Green,Exempt under section 26 of the Freedom of Information Act (2000),Amber/Red,Amber/Red,Red,Amber,Amber,Amber,Amber/Green,Amber,Green,Amber,Amber/Green,Amber,Exempt under section 24 of the Freedom of Information Act (2000),Amber/Green,Amber/Green,Amber/Red,Amber/Green,Green,Amber,Amber/Red,Amber/Red,Exempt under section 43 of the Freedom of Information Act (2000),Amber/Green,Amber/Green,Amber/Green,Amber,Green,Amber,Amber/Red,Amber/Green,Amber,Amber,Amber/Green,Amber/Red,Amber,Green,Amber,Amber,Green,Red,Green,Amber,Amber/Red,Amber,Amber/Red,Amber,Green,Green,Amber/Green,Amber,Amber,Amber/Green,Green
"Description / Aims 
(From GMPP data)","A shared service solution for the BIS network will: deliver a structural reduction in the cost base; provide simpler, transparent and more integrated processes across the BIS family of organisations; and secure continuous cost and process improvement through innovation and the application of a professional business focus.
It can underpin strategic management of BIS and its partners with timely, accurate, valued and well-aligned financial management information.","In September 2012 the Government announced the creation of a business bank to address long-standing structural gaps in the supply of finance to SMEs and mid-sized corporates. The bank, which has been allocated £1bn of Government funding, will be tasked with supporting the development of diverse finance markets for business, tackling market failures in the provision of finance, and ensuring that businesses are aware of and can access the support provided by Government.
The new institution will operate through the wholesale markets in order to unlock institutional investment to benefit small to medium sized businesses; it will not have any retail presence. Rather, it will facilitate the provision of loans, including long-term patient capital, to UK firms through banks and other financial institutions. The 'Business Bank' will be the single public identity and centre of expertise in government on all commercially-minded finance schemes for small and mid-sized businesses. These services will be managed as a single portfolio with operational and budget flexibility.
The bank will commercially-focused, employing finance, investment, business and public sector professionals to pool the expertise of the relevant markets and efficiently build up and manage the bank's operations. It will be able to determine its own priorities, subject to high level objectives, budgets and operating principles set by Ministers. The 'Business Bank' will not seek to replace or compete with existing and future finance providers, but rather to ensure that there is a greater range of providers and products on offer to businesses.","To Introduce loans for those aged 24 or over, undertaking provision at Level 3 and above from 2013/2014. The project will allow savings to be realised through the conversion of grant to loan funding while still allowing access to advanced and higher level provision . Introduction of loans should put greater power into the hands of learners, creating a more responsive system. System should be simple and non-bureaucratic , representing good value for money and making use of Higher Education (HE) infrastructure to minimise disruption and facilitate progression.                                                                                                                                                                                                    ","HM Government is carrying out a programme of asset sales with the purpose of reducing Public Sector Net Debt (“PSND”). The Government has announced intentions to sell the pre-Browne Income Contingent Repayment (ICR) student loan book to contribute to this objective and to realise value to the taxpayer.  This loan book will be sold in a series of tranches over a number of years.  The first tranche of loans is expected to be sold by 2015-16.  As is normal with transactions of this type, there will be a value for money assessment made before each sale. Each sale is required to meet the value for money assessment as well as other key project objectives to be considered a success.  Failure to meet objectives will result in a decision not to sell.","The Government has adopted a policy of asset disposal where there is no longer a good case in public policy terms for continued public ownership.  On that basis, the Department of Energy and Climate Change (DECC), with commercial advice and support from the Shareholder Executive, was mandated by Number 10 to take forward preparations for a sale of HMG’s one-third shareholding in Urenco, a uranium enrichment company.  A sale could realise significant proceeds. The project was transferred to BIS (in the Shareholder Executive) through a Machinery of Government change in February 2013. 

","The objectives of the programme are:
• Introduce a modern, integrated and flexible IT system to enable the safe delivery of HE reform (including changes to borrowers’ repayment terms including variable interest rates);
• Enhance customer service and operational efficiency; and
• Support the transformation of SLC’s business through introduction of a unified technology platform and the standardisation of processes.
","The Francis Crick Institute (formerly UKCMRI) is a joint venture between the UK's largest biomedical research and academic institutions: The Medical Research Council (MRC), Cancer Research UK (CRUK), the Wellcome Trust, University College London,  Kings College, London and Imperial College, London.  A new research Institution will be established involving the construction of a new facility located close to St Pancras station, London.  This facility will accommodate 1,268 scientists when fully operational.  The National Institute for Medical Research (NIMR) will be closed.  This NIMR site at Mill Hill and the National Temperance Hospital site will be disposed of as part of this project.  The project aims are: Sustain UK's position as a leader in biomedical research; Engagement with the most challenging research questions; Be on a scale to compete with major new overseas developments; Promote the health of the public and wider UK economy; Address key concerns of 2006 Cooksey review on publicly-funded healthcare research; Excellent training environment for biomedical research.","The Electoral Registration Transformation Programme was set up to deliver Individual Electoral Registration (IER) in England, Wales and Scotland ahead of the 2015 General Election.  Instead of one person filling in the annual registration form and including everyone's details, individuals are expected to complete their own details and give supporting information, i.e. a national  insurance number and date of birth.  At the same time as the move to IER, online registration was made available to make it faster and more accessible.  During the transisition stage the vast majority of current electors (87%) were automatically confirmed on the register by data matching with other public sector data.  The programme aims to tackle electoral fraud and improve the integrity and completeness of the electoral register.  ","National Citizen Service (NCS) is a flagship government programme that gives 16 and 17-year-olds the chance to learn new skills and get involved in their communities. NCS promotes:
• a more cohesive society by mixing participants of different backgrounds;
• a more responsible society by supporting young people’s transition into adulthood; and
• a more engaged society by enabling young people to work together to create social action projects in their local communities.

NCS brings young people together from different backgrounds (e.g. religious, ethnic and socioeconomic) to work together, and teaches them what it means to be responsible and serve their communities. It is a high quality personal development programme that gives young people a chance to prove to themselves and their peers what they can do.  NCS is part of a broader agenda of improving services and outcomes for young people between the ages of 13-19, reflected in the Positive for Youth policy statement published in December 2011.

NCS builds on a substantial range of previous government initiatives that aim to increase voluntary activity among young people and develop their life and citizenship skills. Such initiatives include the National Young Volunteers’ Service and the Millennium Volunteers programme.  The programme also draws inspiration from international programmes such as the Americorps, a programme developed in the United States that supports volunteering and engagement in social action.","The National Cyber Security Programme (NCSP) was put in place as a consequence of the Strategic Defence and Security Review (SDSR), with a budget of £650 million over 4 years.  Its aim is to deliver a transformative programme to give the UK a strategic advantage in cyber security and resilience.  The programme is managed by the Office of Cyber Security and Information Assurance (OCSIA) in the Cabinet Office. 

With the agreement of Treasury as part of the latest Spending Review, the programme has been extended for a fifth year to 2015-16, with an additional £210m funding. ","The purpose of the programme is to manage the successful delivery of the new pension arrangements against published timetables. Critical success factors:
• Administration system, associated processes and all scheme documentation will be updated to be compliant with final regulations, enabling the scheme administrators (MyCSP Limited) to effectively manage members' benefits under the new scheme in line with SMB Contract requirements.
• All members and prospective members will understand how they are affected by the new scheme, based on regular, clear and effective communication.
• Where members are able to choose when they transfer to the new scheme, members will have had sufficient information to make a choice.
• All employers have been provided with information and guidance to enable them to put members in the right scheme at the right time.","Next Generation Shared Services represents a long-standing commitment allied to the Civil Service Reform Plan to achieve efficiency and cost improvements to back office transactional services in finance, procurement, payroll and human resources services. The Next Generation Shared Services Strategy published in December 2012, established the Government’s strategic goals for Shared Services. 

","ICT contracts for the department are due to expire in November 2015.  This programme is to provide for continuity of operations for ICT services for the CPS beyond Nov 2015. The plan is that the CGI Compass contract will be extended to the end of Mar 2017. The contract will be renegotiated with the Print Services and the Networks and Telephony Services removed from Nov 2015 and Mar 2016 respectively. These services will then be procured through pan-government frameworks (PSN Connectivity, PSN Services and Print Services) prior to removal from the Compass contract. The programme will manage the necessary procurements, contract agreements and service transitions. ","The Enterprise Zones (EZ) Programme is a key part of the Government’s wider plans for local and national economic growth. The 24 Enterprise Zones offer businesses financial incentives, fast track planning and superfast broadband to support the creation of new jobs and business. 
Local Enterprise Partnerships (LEPs) are the key agents overseeing the development of the zones. Delivery is taken forward by varying local partners depending on the exact circumstances of the zone. In the majority of cases, local authorities are closely involved in delivery as will relevant land owners and developers.     
Relevant government departments are working closely with LEPs and other local partners, supporting them to unlock barriers to development and successfully deliver development.  
Since January 2013, the Government has taken a more hands-on approach to manage the programme to ensure no zone is without development by 2015.  Each zone has a series of key actions for LEPs, EZs and Government departments to accelerate progress by 2015.
Programme aims:
• to drive progress in each zone to ensure no Enterprise Zone is without development by 2015;
• to support successful delivery of the 24 EZs so that they create new (net) additional jobs and businesses and contribute to net additional local and national growth.","Disband the Audit Commission and refocus local audit on helping local people to hold councils and local public bodies to account for their spending decisions by: (a) Developing and implementing a new audit regime where all such audits will be regulated within a statutory framework, with oversight by the profession and the National Audit Office (NAO); and (b) Transferring (through outsourcing) the Commission's in-house audit practice into the private sector.","Phase 1 of the Government's Broadband Delivery Programme will deliver superfast broadband (24Mbs+) to 90% of the UK by early 2016 and will deliver universal standard broadband (2Mbps).  This is supported by public investment of over £1.2 billion for delivery to around 4.1 million superfast premises.  This is being delivered through 44 projects and a small number of joint Rural Community Broadband Projects with DEFRA.

Phase 2 of the Government's Broadband Delivery Programme will deliver superfast broadband (24Mbs+) to 95% of UK premises by December 2017, following Phase 1.   This is supported by government investment of £250m, seeking to match with a further £250m of local/European funding, to cover 1 million premises.

BDUK is also running 7 pilots to trial new technologies.","The Government's Mobile Infrastructure Project aims to provide mobile coverage to areas of the UK that have not been covered by the commercial sector by building new mobile masts.  The Mobile Infrastructure Project will improve the coverage of mobile voice and basic data services in some of the most remote parts of the UK. To ensure that benefits of the programme are maximised, it has been extended to 2016.

DCMS have partnered with Arqiva and 4 Mobile Network Operators (MNOs) to identify areas of no coverage and build mobile phone infrastructure.  The project is addressing complete ""Not Spots"" and not ""Partial Not Spots"" for State aid reasons.  Not spots are defined as an area which is devoid of network coverage, from all mobile providers.","The New Tate Modern will provide London with a unique public space for a rich collection of international art, combined with educational initiatives for diverse audience groups.  It will benefit the rest of the UK by serving visitors from all regions, and by bringing art and educational initiatives to Tate galleries and Tate partners throughout the UK.  Tate has always been an important driver of inbound tourism to London and the UK:  the New Tate Modern will enhance the museum's ability to draw tourists, and be a major force in projecting the UK's soft power.  In summary, the New Tate Modern will significantly enhance the UK's reputation as a major cultural force in the world.  The new building will be a model of environmental sustainability, setting new benchmarks for museums and galleries in the UK and globally. ","Super-Connected Cities (SCCP) is the Government’s key programme for improving service quality and supporting digital connectivity and business innovation in its major urban areas.  22 super-connected cities will benefit from faster and better broadband for small businesses. Cities will deploy wireless coverage to city centres and inside public buildings.

£150 million Government investment has been allocated to SCCP to provide by March 2015 delivery of:
 - economic growth through faster and better broadband connections by achieving a minimum of 10,000 connection vouchers to  Small/Medium Enterprises (SMEs) across 22 cities;
 - Wi-Fi Hotspots in up to 1,000 public buildings; and
