year;project_number;project_name;department;report_category;description_aims;colour_rating;rating_comment;start_date;end_date;schedule_comment;total_baseline;yearly_forecast;variance_comment;wlc_baseline_incl_NCG;budget_comment
2021;HMRC_0028_2021-Q3;Protect Connect;HMRC;Government Transformation and Service Delivery;The Protect Connect Programme aims to safeguard the operation of HMRC's most critical repayment risking services, future-proofing them by hosting them in the Cloud and laying the essential foundation for development of future strategic risking capabilities. This aligns both the HMRC Compliance and IT strategies, enhancing the understanding of customers and developing increased insight using a single data and analytics platform.;Amber/red;"The Infrastructure Project Authority's Delivery Confidence Assessment rating is Amber/red.This is primarily due to the following factors: The Delivery Confidence Assessment (DCA) rating for Protect Connect Programme is Amber/Red following internal approval of the revised business case which has recently been approved  by Treasury and Cabinet Office. The IT build part of the Programme is on track to complete as planned; and all key technical milestones due in the last quarter have been delivered to schedule. A key risk to the programme is the high volume of changes which mostly relate to data feeds the system ingests. Consequently work is underway to manage any impact on the schedule or budget such as agreeing the scope of a minimum viable product and seeking to increase the productivity of development teams to ensure timely delivery of the programme.";2019-04-25;2022-05-31;The project end-date is 31 May 2022. This is primarily due to the following factors: Approaching the end of Q4 2020/21, the Protect Connect Programme is currently on schedule. The Programme Plan was refined in Q3 and informed a revised business case with respective funding and spend approvals confirmed. This quarter has seen good progress on build activities, alongside implementation of delivery operating model improvements informed by an external review. These include new delivery roles (e.g. product owners and independent technical assurance) and wider adoption of agile principles, leading to increased collaboration across all teams including our third-party technology suppliers. The main risk to the schedule relates to ongoing changes to data feeds, impacting our Self-Assessment (SA) and Value-Added Tax (VAT) risking processes.  The Programme is implementing a plan to mitigate risk which includes developing the scope of a minimum viable product and increasing the productivity of development teams.;£28.95;£26.25;"The budget variance exceeds 5%. The underspend is the result of the deferring some programme activities which had more flexibility in their delivery timescale in order to reduce funding pressures in 20/21 and slower than expected ramp-up of some contractor resources (Programme Management Office), plus some re-planning to accommodate key changes  required for the effective delivery of the programme.
We now have further confidence in our estimates and have therefore been able to manage some of the risk out of our forecasts.";£105.36;"The projects Baseline Whole Life Cost is £105.36m. This is primarily due to the following factors: The result of the spend activity in year on our Whole Life Costs are likely to lead to only a very slight reduction in overall forecast. The Programme is still progressing towards delivery assumptions consistent with the latest Business Case position.
21/22 is a key period for the Programme as this is projected to be the final year in development, going live in Quarter 4. Therefore, all main build and associated one-off investment activity is currently contained within that year, although the Programme team is considering options for a more phased approach to go live which might reprofile some 21/22 expenditure in 22/23. The remainder of the whole-life appraisal period will cover the future support costs post go-live and Commercial discussions in this area are ongoing."
2021;MOD_0001_1112-Q1;A400M;MOD;Military Capability;"The A400M Programme is intended to deliver and support ATLAS aircraft into service which are capable of:
- Operating in domestic and international air environments, including contested air, to well-found and remote bases and airstrips.
- The inter- and intra-theatre deployment, sustainment and recovery of passengers and freight.
- Providing an aerial delivery capability in order to airdrop personnel and freight to the point of need.
- Providing inter- and intra-theatre aeromedical movement of casualties.
- Providing fixed-wing support to Standing Home Commitments and Contingent Overseas Operations, consistent with Defence Commitments' direction in support of specialist users.";Amber;"Compared to financial year 19/20-Q2, the Infrastructure Project Authority's Delivery Confidence Assessment rating remained at Amber. This is primarily due to the following factors: 

The Senior Responsible Owner's current Delivery Confidence Assessment is Amber. The Senior Responsible Owner considers availability (the provision of aircraft ready to be tasked and flown) to be the most important indicator of Programme health.  This has increased steadily over the last 12 months under the continued watch of the Joint Venture Steering Group.  The Programme still suffers from periods of downturn, is able to react and recover when they occur.  

The need for continued close attention drives the Amber assessment but there are no long-term concerns.

More specifically on Capability Delivery Confidence, new milestones are coming along with increasing confidence of success. Natural Surface Operations graduated to the front line in April 21; Freefall Para trials are underway. The first Tactical Course is planned to finish in September, which will culminate the graduation of further elements of Tactical Capability at the end of the year.";2000-05-17;2024-03-31;Compared to financial year 19/20-Q2, the project's end-date remained scheduled to finish on 31 MAR  2024. ;£191.48;£181.44;"The budget variance exceeds 5%. 

Variance is over 5% of underspend and this is as a result of the savings measures exercises.";£3,783.03;"Compared to financial year 19/20-Q2, the projects Baseline Whole Life Cost increased from £3356.23m to £3783.03m. This is primarily due to the following factors: 

Costs reflect financial estimate to the point of equipment delivery in March 2024"
2021;MOD_0119_1920-Q2;Armed Forces Recruitment Programme;MOD;Military Capability;The Armed Forces Recruiting Programme is the Tri-Service programme responsible for delivering a single, common Tri-Service Recruiting Operating Model for the Armed Forces.;Amber;"Compared to financial year 19/20-Q2, the Infrastructure Project Authority's Delivery Confidence Assessment rating decreased from Amber/Red to Amber. This is primarily due to the following factors: 

The Armed Forces Recruiting Programme's previous Infrastructure and Projects Authority Gateway Assurance Review  took place in June 2020 and resulting in an Amber/Red rating in Delivery Confidence. Following this the Armed Forces Recruiting Programme undertook an Assurance of Action Plan in November which resulted in a revised rating of Amber. 

Successful delivery appears feasible but three significant issues already exist requiring management attention but AFRP have an assured action plan to address them.
 
-	Commercial resourcing/integration; 
-	Key Performance Iindicators development to frame the procurement; and,
-	Drawing the baseline cost model to completion (including cashability).";2018-03-15;2024-09-30;"Compared to financial year 19/20-Q2, the project's end-date increased from 01 February 2023  to 30 September 2024 . This is primarily due to the following factors: 

The Defence Board directed change in the scope of the programme from a single Service to Tri-Service recruiting programme  impacted on delivery dates.

The Investment Approvals Commitee recommended in November 19 a delivery date move from April 22 to April 24, Project end-date is expected to be a minimum of 6 months after delivery based on lessons learned from other large outsourcing programmes within the Ministry of Defence.";£7.36;£7.82;Exempt under Section 43 of the Freedom of Information Act 2000 (Commercial Interests) - Commercial interests.;Exempt under Section 43 of the Freedom of Information Act 2000 (Commercial Interests) - Commercial interests.;Exempt under Section 43 of the Freedom of Information Act 2000 (Commercial Interests) - Commercial interests.
2021;MOD_0078_1213-Q1;Core Production Capability;MOD;Military Capability;Delivers safe nuclear reactor cores to meet the Royal Navy's submarine programme, now and for the long term.;Amber;"Compared to financial year 19/20-Q2, the Infrastructure Project Authority's Delivery Confidence Assessment rating remained at Amber. This is primarily due to the following factors: 

Although significant progress has been made in delivering new manufacturing capability since the last transparency return, the magnitude of the remaining risk is not yet sufficiently low to declare an improved delivery confidence.";2012-04-23;2028-04-30;Compared to financial year 19/20-Q2, the project's end-date remained scheduled to finish on 30 April  2028  . This is primarily due to the following factors: ;£142.22;£141.01;The budget variance is less than or equal to 5%. ;£1,826.16;"Compared to financial year 19/20-Q2, the projects Baseline Whole Life Cost decreased from 1826.71m to £1826.16m. This is primarily due to the following factors: 

The forecast costs for the programme have remained broadly stable with a minor reduction in residual risk as a result of the project's robust governance structures."
2021;MOD_0104_1617-Q1;Armour Main Battle Tank;MOD;Military Capability;"The Armour Main Battle Tank Programme is the extension of the Army's Main Battle Tank capability as part of a balanced force, credible and employable against current and emerging threats until an extended out of service date out to at least 2040.

This will be achieved through a series of projects to extend the life of the current platform to deliver Challenger 3.

These projects will fall under the governance of the overall Armour Main Battle Tank Programme. They include addressing obsolescence, lethality and survivability. Mobility is being addressed through a separate pan-platform project.";Amber;"Compared to financial year 19/20-Q2, the Infrastructure Project Authority's Delivery Confidence Assessment rating remained at Amber. This is primarily due to the following factors: 

With the recent progress in approval of the Full Business Case and subsequent contract awarded to Rheinmetall and BAES Land, I remain confident that this Programme can deliver to cost, time and performance. However, the Infrastructure and Projects Authority will have the opportunity to review the delivery confidence on during their next review in late 2021.

In parallel options are being investigated to accelerate the schedule.";2017-12-18;2026-06-01;"Compared to financial year 19/20-Q2, the project's end-date remained scheduled to finish on 01 June  2026  . This is primarily due to the following factors: 

Schedule dates have been revised during contract negotiation contract signature in March 21.  Key milestones (50% confidence) are: 
- Initial Operating Capability (1 squadron of 18 tanks with crews trained at appropriate collective training standard) - November 27.
- Full Operating Capability (148 tanks delivered): November 30.

These dates are later than envisaged at Initial Gate.  This slip has arisen during contractual negotiations due to the perception in Industry of delivery and cost risk around the Design and Manufacture phases, reflecting that which has been witnessed from other projects.
";£9.40;£9.10;"The budget variance is less than or equal to 5%. 

The Financial Year 20/21 forecast to budget variance of £7.968m (536%) reflects the authorised bring forward of costs from April 21 into March 21 due to an earlier than planned contract award.";£1,399.17;Compared to financial year 19/20-Q2, the projects Baseline Whole Life Cost increased from £1304.19m to £1399.17m. This is primarily due to the following factors: This is due to the provision for the purchase of war stock ammunition under the Full Business Case approval.  This budget was not previously included in previous estimates.
2021;MOD_0076_1213-Q1;Astute Boats 1-7;MOD;Military Capability;To deliver the seven Boat Astute Class within approved performance, cost and time parameters, while actively contributing to the sustainment of the UK submarine design and manufacturing capability.;Amber/red;"Compared to financial year 19/20-Q2, the Infrastructure Project Authority's Delivery Confidence Assessment rating remained at Amber/red. This is primarily due to the following factors: 

The Astute programme had previously reported schedule delays to Boat 4 and Boat 5, given emergent technical issues on Boat 4, which having been resolved allowed Boat 4 to sail from Barrow in April 2020. 

Having seen programme delivery confidence grow in the first quarter of 2020, COVID-19 added risk to the Astute programme, however through commitment to the use of Personal Protective Equipment, working ways and personnel safety, any impacts to the remaining schedules are thought to be minimal. Reprioritisation of tasks in the early stages of the pandemic, plus changing shift patterns and a rigorous testing regime, safeguarded the individual projects.  The most recent Infrastructure and Projects Authority review has concluded that delivery confidence has improved overall.";1997-03-17;Exempt under Section 24 of the Freedom of Information Act 2000 (National security);Exempt under Section 24 of the Freedom of Information Act 2000 (National security);£434.91;£451.47;The budget variance is less than or equal to 5%. ;£10,830.05;"Compared to financial year 19/20-Q2, the projects Baseline Whole Life Cost increased from £10769.42m to £10830.05m. This is primarily due to the following factors: 

The last Reported Whole Life Cost through the Defence Major Programmes Portfolio at Q2 2019/20 was £10,769.423m. There have been increases mainly driven by inclusion of Covid-19 schedule impact assessments across the remaining Boats offset by declaration of cost reductions through BAE Systems Project 2021 efficiency programme. "
2021;MOD_0091_1415-Q3;Armoured Cavalry 2025;MOD;Military Capability;"Ajax forms part of the Armoured Cavalry 2025 Programme. The aim of the programme is to deliver by 2025, a versatile and agile multi-role capability, operating at the heart of the Deep Reconnaissance Strike and Heavy Combat Brigades, that are able to succeed on current and future operations in the most complex and demanding operational environments.

The multi-role Ajax armoured fighting vehicle will transform the Army's advanced intelligence, surveillance, target acquisition and reconnaissance capability as part of the war-fighting division. It will transform the way the Army conducts Deep Ground Reconnaissance and underpins the Army's ability to war fight at the divisional level through the Heavy Brigade Combat Teams. Each Ajax has extensive capabilities, including increased lethality through automated detection systems, a 40mm stabilised cannon able to fire on the move, acoustic detectors, a laser warning system, a local situational awareness system, a high-performance power pack, and best in class protection.";Red;"Compared to financial year 19/20-Q2, the Infrastructure Project Authority's Delivery Confidence Assessment rating increased from Amber to Red. This is primarily due to the following factors: 

The Senior Responsible Owner has adjusted the delivery confidence to Red overall. Delivery schedule delay of the Army's first vehicles meant that the Approved Initial Operating Capability baseline of July 20 was no longer achievable. This was reset to Jun 21 (Probability 50%) and Sep 21 (Probability 90%).

In March 21 the Senior Responsible Owner commissioned an independent Gateway Review of the programme. This assessed the impact of late discovery technical issues during the demonstration phase of the project and the further work necessary to overcome them. It also identified a number of additional interventions necessary to de-risk the schedule to Full Operating Capability.

The principle reasons for the delay experienced included a degree of optimism bias in the schedule for a new generation of armoured fighting vehicle, the technical challenges faced and evidence to support safety case generation, COVID-19 and delivery performance. A detailed action plan has been initiated to rectify the issues identified and all Full Operating Capability assumptions are being re-tested as part of this ongoing activity.

Concurrently, all Initial Operating Capability vehicles have now been manufactured. Advanced First of Type training simulators have been delivered and the training of the Army's own Instructors on the ARES vehicle has commenced.  The underlying technical issues now being worked through will be comprehensively addressed prior to declaration of the Ajax Initial Operating Capability.";2014-01-22;2025-04-30;"Compared to financial year 19/20-Q2, the project's end-date remained scheduled to finish on 30 April  2025  . This is primarily due to the following factors: 

Work is ongoing to test the Full Operating Capability forecast date and any update will be published in due course.";£819.03;£634.37;"The budget variance exceeds 5%. 

Reduction in forecast spend against financial year 20/21 Control Total is  driven primarily by delays experienced in the manufacturing side of  the programme with activity in the following areas re-profiled into future years:

Delivery of fully built vehicles,

Delivery of Peacetime and Military Combat Armour Kits for AJAX vehicles,

Retrofit programme of work to uplift Drop 1 standard vehicles to Drop 3 standard build configuration.

Turret integration work to assemble CTC 40mm Cannon to AJAX Turret.

In relation to In Service Support, In service spares weren't ordered/delivered in line with assumed levels, seeing a reduction in year and reprofile of costs into future years.";£6,353.94;"Compared to financial year 19/20-Q2, the projects Baseline Whole Life Cost increased from £6288.95m to £6353.94m. This is primarily due to the following factors: 

The Whole Life Budgets in relation to AJAX are associated with the completion of Demonstration and Manufacture activities within the programme, resulting in the delivery of 589 AJAX vehicles. The Budgets also include In Service Support until 2025, which is primarily delivered through the contracted General Dynamics UK support solution. This element delivers a support framework and purchase of spares to support in service vehicles.

Although the Baseline Forecast Budget from Q2 19/20 £6288.953m to Q4 20/21 £6353.940m appears to increase by £64.987 this is because historic budgets are not adjusted as Programme costs and budgets are rolled forward into future years. The Whole Life Budget c.£6.4Bn currently covers the period up to the end of Manufacture as per the Main Gate approval.  The Whole Life Costs from Q2 19/20 £6143.994m to Q4 20/21 £6005.698m have actually reduced by £138.296m.

Whole Life Cost reductions were driven by removal of the Fire, Support and Overwatch requirement from the Demonstration work within the AJAX programme. Also efficiencies were realised in the In Service Support costings where modelling identified further coverage from current contract arrangement (across spares and Contractor Logistic Support) this then enabled a costing reduction."
2021;MOD_0118_1718-Q3;Clyde Infrastructure;MOD;Military Capability;The Clyde Infrstructure Programme is managing the design, delivery and transition into operational use of new build and updated infrastructure facilities in Her Majesty's Naval Base Clyde (Faslane and Coulport).;Amber;"Compared to financial year 19/20-Q2, the Infrastructure Project Authority's Delivery Confidence Assessment rating remained at Amber. This is primarily due to the following factors: 

Following overspend in some early projects, the programme was re-baselined to remain affordable. All changes were endorsed by the Clyde Infrastructure Programme Sponsor Board and briefed to the Ministry of Defence Major Programmes Portfolio Sponsor Group. 

The programme is pivoting its delivery model and approach from 'new build' to 're-capitalisation' while minimising site operating risk. This requires all aspects of the programme to integrate with the wider site operations. A new operating model was adopted to support this.

Good progress was made in period against the challenges identified in internal reports and the November 2019 Infrastructure and Projects Authority Gateway Assurance Review.  A further Gateway Assurance Review will be carried out in September 2021.

Overall the Delivery Confidence Assessment remains Amber and will remain so until the revised operating model and associated behaviours are embedded within both the Programme delivery and Site operating teams.";2015-09-07;2032-03-30;"Compared to financial year 19/20-Q2, the project's end-date decreased from 01 April 2032  to 30 March 2032 . This is primarily due to the following factors: 

 - 2032 is the end date agreed when the programme was rebalanced during 2017, based on the forecast completion date of all projects. This date remains extant.

 - The primary drivers for the completion date include the DREADNOUGHT Class in service date and achieving the endorsed ambition of a Single Integrated Operating Base. The volume of concurrent activity that can be commissioned is limited by the need to maintain operations and deconflict activity in a geographically constrained highly secure environment. 

Since 30 September 2020 baseline project end date of 30 March 2032, the programme completed Capability Audit to review the Portfolio Definition, which had no immediate impact on the programme completion date, although additional items of scope are under consideration by the respective Sponsor areas, which, if subsequently endorsed for Clyde Infrastructure Programme  delivery, may change this.";£91.17;£93.36;The budget variance is less than or equal to 5%. ;£1,586.90;"Compared to financial year 19/20-Q2, the projects Baseline Whole Life Cost decreased from 1774.57m to £1586.90m. This is primarily due to the following factors: 

The whole life cost of the programme reflects the budget set following rebalance of the programme and formal agreement of the budget during 2017.  This also reflects the budget for the 15 year life of the programme from Financial Year 17/18 to Financial Year 31/32"
2021;MOD_0121_2021-Q4;Collective Training Transformation Programme;MOD;Military Capability;The Collective Training Transformation Programme seeks to transform both the management and delivery of training and the experience for those going through training.;Amber;"The Infrastructure Project Authority's Delivery Confidence Assessment rating is Amber.This is primarily due to the following factors: 

While there is a clear, resourced and detailed schedule in place to develop a robust Outline Business Case by mid-2022, resourcing within the core Programme team and cost pressure against the 10 year funding profile still need to be addressed.

Some improvement in the manning situation should be delivered within the next few months as new staff are recruited in, and in the meantime, contractor support is being used to address the key capability gaps.

Shortfalls in the 10 year funding profile against the resourcing requirement will be raised to the Army Top Level Budget holder for consideration for relief within the next planning round.";2018-10-12;2032-01-01;The project end-date is 01 January 2032. ;£5.95;£5.95;The budget variance is less than or equal to 5%. ;£976.26;"The projects Baseline Whole Life Cost is £976.26m. This is primarily due to the following factors: 

Financial Year 22/23 onwards forecast is based on the Collective Training Transformation Programme's Enterprise cost model V0.1. 

Profiles have not yet been categorised into Defence Expenditure Limits and are presented on a deterministic outcome only."
