Following Financial Close in December 2013, construction commenced as planned in early February 2014. The construction programme has been delayed due to the discovery of asbestos on the site. However, the PFI Consortium has developed remedial measures and a revised programme shows a steady recovery of lost time so that the contractual completion date remains unchanged at March 2017.  The Trust continues to closely monitor the construction programme. Construction delay and asbestos removal are both Consortium risks - the Trust holds no risk.  The project has continued to receive high or significant assurance from the project's external auditors. ","The MPA RAG rating was Green at Q2 2014.
The Trust confidence assessment was originally well founded as its OBC was agreed by the DH and HMT. It has subsequently had issues to resolve regarding affordability due to externally driven financial pressures e.g. tariff reviews and increasing Quality Innovation Productivity and Prevention (QIPP) demands. This led, in conjunction and agreement with the NHS Trust Development Authority (TDA), to the project being appropriately downsized to help mitigate the affordability position.","The MPA RAG rating was Amber/Green at Q2 2014.
The RAG rating reflects the authorisation of the OBC by DH/HMT and a successful commencement of the procurement. Since Q2 2014 one bidder has withdrawn and one failed to submit a bid at interim submission. The Trust has received a compliant interim bid from one bidder. The programme may change as a result .","The MPA RAG rating was Green at Q2 2014.
The delivery confidence assessment has been set at Green as shingles immunisation was successfully introduced on schedule on 1 September 2013. Vaccine uptake in the first full year of the programme was 62% for 70 year olds and 60% for 79 year olds.  A GMPP Exit Review was carried out in November 2014 and the Major Projects Authority has decided that this programme should be removed from the GMPP.","The MPA RAG rating was Amber/Green at Q2 2014.
The programme achieved an Amber/Green rating due primarily to the lack of clear governance arrangements at that time.  In response to the recommendations the programme team have established a robust programme governance model and, as such, five of the six recommendations have now been closed.   The remaining recommendation, for Trusts to create clear benefits realisation plans, is currently being addressed by Trusts with support from the programme team, as they prepare their Full Business Cases and prepare for deployment. Completion of this would help support a path to a Green delivery confidence.","The MPA RAG rating was Amber at Q2 2014.
The Amber assessment reflects a delivery confidence that Care Identity Service delivery in February 2015 appears feasible. As with all major deliveries of this scale there are a number of significant risks that are being managed to mitigate the impact to the programme.  Hence, our pathway to a Green assessment is based upon the following actions being underway:
• There have been a number of rehearsals, working closely with BT Health, to validate the approach to a complex transition;
• There has been considerable stakeholder engagement, the develop of a national e-learning tool and considerable Registration Authority training;
• The non-functional assurance (volumes and performance testing) is underway and is a significant element that must pass the technical assurance activities, this remains a significant risk until the assurance activities conclude in mid February; and
• A 24/7 end to end service and IT operational management capacity has been established and will adopt the current spine service 1st and 2nd line support mechanism.","The MPA RAG rating was Amber at Q2 2014.
There has been significant progress:
• As of January 2015 almost 50 million records have been created, over 86% of the population of England. 
• Use of Summary Care Record has increased with over 30,000 views of records per week (equating to one record viewed every 20 seconds) and rising.
• The ministerial commitment to enable a third of all A&Es, Ambulance Trusts and 111 with Summary Care Record has been successfully delivered.
• A total of 130 Community Pharmacies are live with Summary Care Record, with positive initial findings from the proof of concept exercise.
• First of Type testing for improved delivery of additional information within TPP SystmOne GP system (Summary Care Record v2.1) has commenced.
• The programme is current on track to achieve a Value for Money ratio of 3.86 (net present value), with additional benefits to be quantified.
• Summary Care Record is referenced in the National Information Board’s framework, recognising that the solution has further potential.

Actions taken to improve delivery confidence include:  The Programme has undertaken a stocktake to ensure that it structured in the optimal way for the next phase of delivery; the Senior Responsible Owner role has been reviewed and clarity provided to the Programme; a review of the Stakeholder Management process has been completed and improvements implemented;  the Programme has developed a more robust process for managing changes supported by an Expert Advisory Committee which has been established to provide lay input, governance and greater patient voice to Programme.

Remaining actions underway to progress the Programme towards a Green delivery confidence include: Plans and processes in development to move completed constituents parts of the programme into Business As Usual live service;  improvements to communication approach and marketing of Summary Care Record, involving  a digital media campaign, targeted messages at specific groups and increased patient engagement, underpinned by a Communications Plan; Programme Board members reviewed and new members co-opted as required to bolster expertise and governance.

","The MPA RAG rating was Amber/Red at Q2 2014.
The Programme is progressing towards a positon where there will be confidence in going live by completing the required testing of the solution, progressing contracts for the support of the live service with suppliers to conclusion by mid-February and ensuring the required documentation and processes are in place prior to go-live through the use of Service Acceptance Criteria. These are the key areas where progress is required to enable the service to move into a live environment and the Programme Team is prioritising these actions to ensure go-live is achieved.

The MPA noted the improvement in the  quality and quantity of the resource available to the Programme. Work has also been undertaken over this period to strengthen the governance, planning and commercial aspects of the project. The Amber/Red rating was primarily due to the level of activity still required to enable the February go-live date to be achieved. In particular there was concern around the Service Contracts being completed in time to support the live system.

The two HIGH recommendations of the review relate to a critical path and to contingency arrangements. Work has been undertaken to enhance the programme plan following the revised go-live date, highlighting the revised critical path. In terms of contingency planning options have been reviewed to enable SUS to go-live in the absence of Care Identity Service system going live. Proposals on both these issues have been accepted by the Programme Board and will be key to increased delivery confidence. The two MEDIUM recommendations on programme board composition and on benefits planning are to be addressed in coming months, following transition go-live.
","Implementation has been successful to date. Over 5 million people automatically enrolled by December 2014 with an opt-out rate averaging less than 10 per cent. Rates of on-time compliance remain very high for those employers who have staged so far, and the Department successfully negotiated high staging volumes in Summer 2014. The Programme remains on course to complete implementation to timetable. 

The Programme’s focus now is to support the circa 1.3 million small and micro employers who begin staging from June 2015. The Department is refining the ways in which it has supported larger employers in order to meet the needs of smaller employers, and to this is:
• testing variants of its communications channels to identify the most effective means of engagement and of securing timely compliance; 
• helping payroll providers, advisers and intermediaries to fully support employers; and 
• working closely with pension scheme providers and other sectors to manage the capacity required to support the delivery of the programme. 

The MPA reviewed the Programme in December 2014 and supported the Department’s approach. The current rating balances the good progress so far and the scale of the challenges to come.
","Following the MPA review in May 2013 that considered the successful delivery of Phase 1, all recommendations were accepted and addressed by the Programme. 

Phase 1 of the Programme is now complete. This introduced the new IT system, a mandatory gateway to encourage family based arrangements and, where these arrangements cannot be made, an application to the statutory 2012 scheme.  

The MPA revisited the Programme in February 2014 and subsequently increased the delivery confidence rating for successful delivery of Phase 2. All recommendations from this review were accepted and addressed by the Programme. 

Phase 2, which went live between 30 June 2014 and 11 August 2014, introduced client charging and triggered the start of proactive historic case closure activity.
","An MPA review was completed in November 2014. The Delivery Confidence assessment reflects that: 
• All previous MPA review recommendations have been implemented.
• All Jobcentres were live with Day 1 Conditionality and Weekly Work Search Reviews and had achieved 50 per cent for Weekly Work Search Reviews by the end of October 2014. 
• All of the other measures (Quarterly Work Search, Increasing Lone Parent Conditionality and English Language Requirements – England only) were live from April 2014, with English Language Requirements going live in Scotland and Wales from 27 November 2014.   
","A revised business case has been developed which outlines the potential reduction in estates demand and the associated people impacts.  The Programme has also taken steps to ensure its work is aligned with other transformation programmes, during a period of unprecedented welfare reform.  Regional teams have been put in place and are responsible for exploring the potential future estates blueprint in each of 7 regions across the country.  ","As result of an MPA review, the Programme has reviewed its risk management process so that implementation related risks are discussed regularly, including at the Risk Review and Programme Boards.

The Programme, with the supplier, has ensured that there are robust integrated plans in place for the delivery of FfW which is monitored through regular checkpoint meetings and reviewed at Programme Board.

The Programme has established clear engagement strategies for General Practitioners, employers and employees; including clear responsibilities for each activity.  This is monitored through regular Communications Working Group meetings and through the Programme Plan.
","The Programme had an MPA review in November 2014. This recognised the good governance processes in place and the significant progress made by the Programme in the last year. The review team stated that it was particularly impressed by the Programme’s benefits management, describing it as ‘an exemplar across government’. ","An MPA review was completed in November 2014.
The delivery confidence assessment reflects that:
• All previous MPA recommendations have been implemented.   
• All Jobcentres were live with all Help to Work measures by 31 December 2014.
• Management Information reports that have been produced have been tested and confirmed as fit for purpose.
• Robust contract management is in place.",The Programme has taken action against the nine recommendations the MPA made in October 2014 with seven of the nine recommendations having been cleared by February 2015. Recent confirmation of the Programme’s strategic direction will enable the outstanding actions relating to programme plans and dependencies to be resolved quickly. ,"An MPA Review in January 2015 made a number of recommendations that were accepted and are currently being addressed. The review acknowledged that:

• The Project has developed, in partnership with HMRC, an integrated IT plan that encompasses the full programme of pension changes.
• The Project is now fully constituted with appropriate governance and an experienced project team in place.  
• The Detailed Business Requirements have been defined and agreed ready to move into the build and test phase in readiness to deliver the IT changes in October 2015 to meet the April 2016 policy implementation date.
• The Project has implemented an integrated communication campaign to inform existing and future customers what to expect. A bespoke statement service has been set up for future customers, who are within 15 years of their state pension age to find out what they will get under the new rules. This service will subsequently be replaced by a new Digital Statement service which is currently being developed in parallel as a separate project and jointly with HMRC. 
","The Programme had an MPA review in November 2014 which recognised the significant improvements made since the previous review in May 2014.

Improvements to processes, IT and increased capacity have resulted in productivity increases and greater flexibility for Assessment Providers and the Department. These changes have resulted in a significant increase in clearance of applications to PIP, evident in  the statistics published in January 2015. 

The Programme continues to develop its approach for transforming and improving the PIP service, including the introduction of online services. 
","The Programme's delivery plan was announced in September 2014. At the same time HM Treasury agreed the Strategic Outline Business Case.  It set out an approach which reduced risk across the lifetime of the Programme. These plans were developed and agreed with delivery partners, including Local Authorities and HMRC.  The plans included:
• Continued expansion of the existing UC service to the whole of the North West by December 2014.
• Extension of this Live Service to include families by March 2015.
• Introduction of UC to single claimants nationally throughout 2015-16 .
• A controlled test of the UC Digital Service commencing on 26 November 2014 in a single postcode area testing UC for all claimant types
• Establishing a UC service across Great Britain by 2017 with the caseload continuing to build thereafter.
","The project continues to be run under the FCO approved IAAP process with regular governance meetings, risk and status reviews.","Although some progress has been made against the Gate 4 Action Plan, the suppliers' transition plans have been revised and are currently showing completion in late April 2015 (SMI) and July 2015 (DI). In addition, the FCO is currently seeking approval to embark on a major Technology Overhaul (TO) of its ICT infrastructure. The full impact of TO on the DI and SMI contracts is still to be confirmed pending completion of the TO business cases and associated approvals. ","Following the review, the Full Business Case was developed further as recommended and subsequently received approval from HM Treasury and Cabinet Office.  Further work has since been done on Benefits and Key Performance Indicators.  Government departments are continuing to work well together on implementation including sharing of best practice.","The project continues to be run under the FCO approved IAAP process with regular governance meetings, risk and status reviews.",Debt Management and Banking resources are being maintained within operational tolerances with key performance indicators showing strong delivery across the business.,"Two of our four digital exemplars, Your Tax Account and Digital Self-Assessment, moved into ‘public beta’ (opening  the service to the wider public whilst continuing to ask for feedback on how it can be improved) on 27th May 2014.

Pay As You Earn (PAYE) for Employees (formerly PAYE Online) is ready for public beta. Due to the dependency on the Government Digital Service IDA (Identity Assurance) for Citizens, PAYE will move into public beta mid October 2014.
","Debt Collection Agencies programme activity treated as business as usual by DMB.  The Debt Market Integrator go live has been delayed and as a result DMB will be looking at extending the Debt Collection Agencies contracts. We have reprofiled the 14/15 Work Programme that identifies debts that are suitable to place in the Debt Collection Agencies process. This takes into account the delayed start for the Debt Market Integrator, to ensure we fully utilise the private sector to maximise the capacity available in order to address the debt balance. We are working to reprofile the benefits and costs.",VAT Registration Transformation (VRT) the final delivery of the One Click programme has taken place. The One Click programme full business case will be finally updated following completion of work on the actions arising from the VRT project post implementation review. Work on formal closure of the VRT project and One Click programme are underway. ,"Results for the first part of 2014-15 have exceeded the forecast. The programme are seeking to establish the confidence levels in the year end forecast.

","Additional IT changes were successfully delivered in the Summer of 2014. 

A phased approach to the implementation of in-year late filing penalties from October 2014 was approved at the July Programme Board meeting.  In-year late filing penalties for large and medium employers will commence in October 2014 and small & micro employers will commence from March 2015. Activities to support this approach are progressing well. Activities are also on-going to support the implementation of in-year late payment penalties from April 2015.
","The main drivers for the RAG status are the challenging delivery timeline set alongside a legal challenge from voucher providers in the existing employer supported childcare scheme to the decision to appoint National Savings and Investment as the childcare account provider for Tax-Free Childcare.

","Benefits over the SR10 period are set to total £1,341.3m against a business case total of £1,310m.","The Green RAG status reflects the extension of the Scheme to 2015 and that the number of payment issued by the Scheme at the end of Q3 2014/15 has reached  91% for individual policyholders and 81% of group scheme policyholders and continues to slowly increase.    

 Building on the success of the advertising and further tracing work begun in Q3 2013/14, work has continued to try to find the remaining  c160,000  policyholders unpaid at the end of Q2.  Following a successful pilot of the Department for Work and Pension’s letter forwarding service, this has been rolled out where the Scheme holds a National Insurance number, date of birth and address. At  the end of Q3 2014/15,26,000 letters sent the DWP's bulk letter forwarding service had resulted in 9,318 payments.  Success rate monitoring will continue in coming months to ensure cost effectiveness is maintained in future tracing activity.

Progress has been made in reducing the number of the remaining,  most difficult to trace, unpaid policyholders   despite these efforts. Whilst payments will continue, it is expected that, despite these continuing efforts to trace them, c12.8% of the policyholder population will not be found.
",Escalation to Cabinet Office for Next Generation Shared Services  (NGSS) ISSC2 programme to provide revised plans which will validate the Adelphi go-live date and commercial impact.,Good progress has been made across the majority of delivery areas and we have made improvements in the flexibility and reliability of system capabilities.,"The October 2013 Border Systems Options Review recommended the creation of a new programme, called Digital Services at the Border, to replace current IT systems.  A new Programme Director is being recruited, along with a Portfolio Director to oversee the broader Border Systems Portfolio of which DSAB is part.",The project is undertaking additional assurance of the solution design to ensure that the solution will meet requirements and additional expertise has been introduced.,The Programme has completed all the recommendations raised from the Project Assessment Review & Major Projects Review Group Panels held during OBC approval in April/May 2014. ,The programme has successfully transitioned to business as usual.,"An action plan to address the review recommendations is in progress and reviewed by the programme board on a monthly basis.

The reasons for this rating are:
• Timescales for the programme are challenging, the Programme continues to work with suppliers to address and improve the speed of delivery. 
• This is the first large scale Agile programme delivered within the Home Office, new ways of working are being developed and the programme is refining the delivery approach with its suppliers. ",The NGOV project has transitioned to business as usual with effect from 1 October 2014. Transition has been successfully delivered in all locations unless the service has been suspended due to security issues. Any further decision to open in these locations will be managed through business as usual processes.                                                ,"The timescale pressure has been relieved by the identification of a ‘handover period’ with the incumbent suppliers contracts: however, the significant financial and solution / plan risks for the programme remain. The programme is working closely with Government Digital Service (GDS) to ensure the right level of disaggregation and is potentially looking to re-use GDS's solutions from their recent disaggregation.","Following the Project Assurance Review in October 2014 an 11 point action plan was implemented based on the recommendations in the report, 5 of which were able to be closed at the time of the Assurance Action Plan (AAP) in January 2015. Work on the remaining open actions is ongoing. ","AMS and the online channel went live in September 13 and November 13 respectively. Since February 14, all new applications have been processed through AMS with a total of around 28% of applications from overseas and in the UK being made through the new online channel. The programme has now transitioned both AMS and the online channel into business as usual. ","The delivery confidence at Q2 FY14/15 reflected the fact that the Programme was entering a critical phase with many time-sensitive activities subject to external international dependencies. Most notably, there was a significant reliance on the six-nation Certification and Qualification Committee (CQC) to sentence the remaining evidence needed in time to support the award of Military Certification which would allow operation of the first aircraft.  Secondly, there was a dependency on Airbus Defence & Space to supply an aircraft of a mature enough standard to pass UK acceptance checks. Finally, aircraft acceptance to provide a 'Day 1' capability was also dependant upon the ability to support flying operations in accordance with engineering maintenance contractual obligations.
More than 20 formal governance meetings were held throughout August and September 2014 in order to carefully manage risks associated with delivery and first operational flight; these included operator level working groups through to a series of executive-level readiness reviews, and meetings with industry. This approach ensured that all support requirements were in place at RAF Brize Norton. The first A400M aircraft (ZM400) arrived at RAF Brize Norton on 17 November 2014 and completed its first training sortie the following day, as planned.
