year;project_number;project_name;department;report_category;description_aims;colour_rating;rating_comment;start_date;end_date;schedule_comment;total_baseline;yearly_forecast;variance_comment;wlc_baseline_incl_NCG;budget_comment
2021;MOD_0106_1617-Q1;Maritime Patrol Aircraft;MOD;Military Capability;To deliver a Maritime Patrol Aircraft to provide persistent, responsive, effective and adaptive Military Capabilities in the Under Water, Above Water, Littoral and Land environments.;Amber/red;Exempt under Section 26 of the Freedom of Information Act 2000 (Defence);2014-07-08;2024-04-01;"Compared to financial year 19/20-Q2, the project's end-date remained scheduled to finish on 01 April  2024  . This is primarily due to the following factors: 

- declaration of Full Operating Capability.";£654.46;£654.11;The budget variance is less than or equal to 5%. ;£2,013.02;"Compared to financial year 19/20-Q2, the projects Baseline Whole Life Cost increased from £1996.00m to £2013.02m. This is primarily due to the following factors: 
- A change to the accounting treatment for sonobuoys.
-  Continuing variances due to the Foreign Exchange Rate.
- Since the Main Gate Business Case there has been a maturing of the cost of supporting the aircraft.
- The US Navy has matured its concept for aircraft sustainment and depth maintenance requirements, which have informed the UK Programme's planning and sustainment/maintenance concepts."
2021;BIS_0014_1415-Q3;New Polar Research Vessel;BEIS;Infrastructure and Construction;Royal Research Ship Sir David Attenborough will replace two existing polar research/supply vessels with one dual purpose ship which planned to save £102m over 30 years;Amber/Green;Compared to financial year 19/20-Q2, the Infrastructure Project Authority's Delivery Confidence Assessment rating decreased from Amber to Amber/Green. This is primarily due to the following factors: Programme remains on scheduled but no time or cost contingency remains. Good progress has been made with interim acceptance happening in November 2020 an d the project remains on target for its first Antarctic season during 2021.;2014-05-01;2022-12-31;Compared to financial year 19/20-Q2, the project's end-date remained scheduled to finish on 31 December  2022  . This is primarily due to the following factors: Testing and trails are underway and remain on track.;£43.00;£43.00;The budget variance is less than or equal to 5%. None, forecast remains on target.;£1,419.50;Compared to financial year 19/20-Q2, the projects Baseline Whole Life Cost increased from £1403.00m to £1419.50m. This is primarily due to the following factors: The whole life costs represents costs until 2043/44. These costs include the project costs until closure and recurring Antarctic Partition and Logistics infrastructure budget costs.
2021;DECC_0010_1112-Q1;Smart Metering Implementation Programme;BEIS;Infrastructure and Construction;The Programme aims to replace existing traditional gas and electricity meters across Great Britain with smart gas and electricity meters resulting in a cleaner, cheaper and more reliable energy system. Smart meters are a key enabler of technologies such as electric vehicles, smart tariffs and microgeneration to be efficiently integrated with renewable energy sources, underpinning the cost-effective delivery of Government's net zero commitment.;Amber;"Compared to financial year 19/20-Q2, the Infrastructure Project Authority's Delivery Confidence Assessment rating remained at Amber. This is primarily due to the following factors: The IPA and SRO Delivery Confidence Assessment (DCA) rating has continued to be Amber,  due primarily to the following factors;

-	There were 23.6 million smart and advanced meters operating across Great Britain as of end December 2020
-	A new regulatory framework was announced in June 2020 for implementation in July 2021. 
-	Re-mobilisation support across industry delivery partners was established to respond to the impact of COVID-19. Industry has made good progress in re-mobilising workforces and BEIS has continued to provide support to industry through the latest national lockdown.
-	Customer smart meter eligibility is increasing following positive developments on resolution of residual technical issues.
-	BEIS continues to work with energy suppliers to increase consumer uptake through improved consumer engagement and operational fulfilment activities, supported by consumer policies, and to drive faster progress towards a market wide roll-out.";2009-12-02;2025-06-30;Compared to financial year 19/20-Q2, the project's end-date increased from 31 December 2024  to 30 June 2025 . This is primarily due to the following factors: Energy suppliers were given an additional six months to meet their smart metering obligations, recognising that COVID-19 and lockdowns restricted energy suppliers' ability to enter premises. The scheduled baseline project end date is now 30 June 2025.;£1,139.18;£1,139.86;The budget variance is less than or equal to 5%. Budget variance less than 5%;£20,136.95;Compared to financial year 19/20-Q2, the projects Baseline Whole Life Cost remained at £20136.95m. This is primarily due to the following factors: In comparison with 19/20 Q2 the Baseline Whole Life Cost has remained constant.
2021;DECC_0005_1112-Q1;Geological Disposal Facility Programme (GDF);BEIS;Infrastructure and Construction;The primary objective of the programme is to site and construct a permanent geological disposal facility (GDF) as the safe, secure and environmentally responsible solution to the long-term management of higher-activity radioactive waste in the UK, excluding Scotland.   The programme also supports the delivery of the UK's nuclear new build programme because before development consents for new nuclear power stations are granted, the Government needs to be satisfied that effective arrangements exist or will exist to manage and dispose of the wastes they will produce.;Green;"Compared to financial year 19/20-Q2, the Infrastructure Project Authority's Delivery Confidence Assessment rating decreased from Amber to Green. This is primarily due to the following factors: The programme delivery confidence has moved to green in the period due to the progress in engaging volunteer communities; two working groups have been formed and additional interested parties are being actively engaged. The transformation of the Geological Disposal Facility (GDF) programme organisation continues with ongoing recruitment to meet the delivery needs however, there is still work to do on the detailed transformation planning considering the future changes at RWM to enact plans for the NDA's Single Waste Division.  It should be noted that the GDF programme spans a significant time period on a whole life basis and the programme is still at a very early stage in the lifecycle, construction is due to start in the 2040s. The programme still faces exceptional uncertainty levels at this stage, with success dependent on agreeing a site within a willing community and the associated geological uncertainties this presents.";2008-06-30;2040-12-31;Compared to financial year 19/20-Q2, the project's end-date remained scheduled to finish on 31 December  2040  . This is primarily due to the following factors: Significant progress has been made over the past year and work continues to drive the schedule and mitigate risks to meet the delivery milestone dates.  The first two working groups have been established enabling discussions to begin with potential host communities and pioneering research is underway to underpin delivery of the Geological Disposal Facility (GDF) including the testing of a new approach to the sealing of deep boreholes.  The organisational transformation continues to enhance capability as the programme moves from research to delivery leading to enhanced planning for the GDF and additional engagement with regulators building confidence and maintaining a constructive dialogue.  The programme also continues to progress risk mitigation activities and work has been launched to support the bring forward of seismic surveys in support of site evaluation, a key step in the overall GDF site selection process.;£48.47;£33.60;"The budget variance exceeds 5%. The main variances and reduced in year spend are due to two main reasons:
1) There were delays to the initial launch of the siting process resulting in a fewer number of assumed / forecast working groups and the associated costs in this FYr.  This position has started to improve as there are now two working groups in place.   The difficulties associated with CoVID have reduced the planned stakeholder engagement and communication activities with an associated reduction in cost. 
2) There have been delays in the technical work and associated spend; commencement of site evaluation works due to the delays in working group formation and search area agreement.";£12,743.00;Compared to financial year 19/20-Q2, the projects Baseline Whole Life Cost remained at £12743.00m. This is primarily due to the following factors: The costs presented are only currently the Nuclear Decommissioning Authority (NDA) net costs for the Geological Disposal Facility (GDF) programme - the information on Whole Life Costs (WLC) is derived from figures used in NDA's 2018 Annual Report and Accounts (ARAC) scenario GDF cost estimate (in Sept 2018 money values). Note that the costs reported here only cover NDA costs related to a GDF for legacy waste  and waste arising from the existing fleet of nuclear reactors, it does not include any provision for waste disposal from a new nuclear build programme, as this will be funded by new nuclear operators. In line with other Government programmes at an early stage of development, the WLC estimate does not include any allowance for risk, uncertainty or optimism bias. The estimate is being reviewed alongside the wider update of the programme business case which will be available in due course.
2021;BEIS_0001_1617-Q2;Heat Networks Investment Project;BEIS;Infrastructure and Construction;"HNIP is to help create a self-sustaining heat network market by:
1. Increasing the volume of heat delivered by new or expanded heat network applicant projects through the provision of a proportion of their capital costs in the form of Government loan and grant finance; this will leverage private finance, and other investment funding, into the heat networks. 
2. Delivering carbon savings for carbon budgets 4 and 5 (2023-2032). 
3. Building market capability to develop optimised heat networks that will meet local needs and support heat networks development.";Amber;Compared to financial year 19/20-Q2, the Infrastructure Project Authority's Delivery Confidence Assessment rating remained at Amber. This is primarily due to the following factors: HNIP Main Scheme is progressing to schedule with all awarded funding drawdown on time.  Key delivery milestones are on track as the project heads into its final year.  To date c.80% of the Main Scheme's available budget for years 1 and 2 has been committed.  The third-party funding initiative platform launched in December 20.;2015-11-25;2022-03-31;Compared to financial year 19/20-Q2, the project's end-date increased from 31 March 2021  to 31 March 2022 . This is primarily due to the following factors: HNIP is being delivered in two phases: the pilot scheme, which is complete, and the Main Scheme which is now in the final year of delivery and scheduled to close to applicants in November 21.;£153.60;£98.57;The budget variance exceeds 5%. The year-end capital spend was 75% of the available in-year budget, and the lower than planned spend was primarily due to three awarded projects withdrawing after the final in-year funding round.;£375.90;Compared to financial year 19/20-Q2, the projects Baseline Whole Life Cost remained at £375.90m. This is primarily due to the following factors: Whole life cost is currently below budget baseline. This is due to the slower than planned Main Scheme mobilisation post launch, and the late withdrawal of three projects awarded funding in year 2 of the Scheme.
2021;BEIS_0005_1920-Q4;Met Office Supercomputing 2020+ Programme;BEIS;ICT;"Delivering our future supercomputing capability through the procurement and installation of a replacement and increased supercomputing capacity to meet the contracted end of life timescales of our current systems. This will include: storage, observations networks, post-processing systems and services, tooling for data exploitation; delivery and support resources throughout the investment lifetime; data centre hosting, networking and security services.";Amber/Green;The Infrastructure Project Authority's Delivery Confidence Assessment rating is Amber/Green.This is primarily due to the following factors: The programme continues to report as  amber, due to the tight timescales and the complexity of the programme. The risk of delays are being mitigated where possible, we successfully passed the pre PIC panel in Dec and achieved FBC approval in Feruary 2021.  Procurement process is nearing its final stages and the Programme has assigned a Programme Director and recruited a Programme Manager.;2018-01-01;2032-08-11;The project end-date is 11 August 2032. This is primarily due to the following factors: The programme is expected to sign the contract for this investment on 16-Apr-21 as scheduled..  The schedule is baselined at that point and at present there are no expected deviations.;£6.90;£6.90;The budget variance is less than or equal to 5%. There is currently no budget variance.  Full term forecast now entered to reflect preferred bidder costings.  Final Business Case approval confirmed so programme has been re-baselined to reflect this new approval.;£1,242.05;The projects Baseline Whole Life Cost is £1242.05m. This is primarily due to the following factors: Overall programme costs are just over £20m higher than last submission reflecting the new approval.  Cost increase is due to programme estimates across all aspects of the programme being higher than in original submissions, partly as a result of the winning bidders technical solution.
2021;BEIS_0006_2021-Q3;Green Homes Vouchers Programme;BEIS;Government Transformation and Service Delivery;"The Green Homes Grant Scheme (vouchers) will provide £356m of funding support to the Energy Performance and Low Carbon Heat industries.
The  scheme closed to new applications at 31 March, all existing applications and vouchers will still be honoured. Any residual funding will be transferred into other schemes.";Red;"The Infrastructure Project Authority's Delivery Confidence Assessment rating is Red.This is primarily due to the following factors: The  programme was set up at pace in order to assist the economy in its recovery, following the COVID pandemic. In moving at such a speed the project had to accept certain risks when initiating and were aware that delivery confidence could be low in the short to medium term. 

 Existing voucher applications received before 31 March will continue to be processed and honoured whilst the scheme is closing.  Any residual funding will be transferred into the Green Homes grant Local Authority Delivery and Social Housing Decarbonisation Fund schemes in FY21/22";2020-09-01;2021-05-31;The project end-date is 31 May 2021. This is primarily due to the following factors: Following an announcement in the Prime Ministers 10 Point Plan for Green Industrial Revolution, the Green Homes Grant Scheme was due to be extended from March 2021 to March 2022. A further announcement was made on 27 March detailing the closure of the scheme to new applications. The timescales of the project have been revised to enable the issuance of existing voucher applications that were received before 31 March 2021.;£125.40;£71.63;"The budget variance exceeds 5%. The budget for the scheme in FY20/21 was reduced to £75m from £1.5Bn owing to the level of uptake for the scheme, impact from COVID, and the performance of the Grant Administrator in issuing vouchers in a timely manner. The scheme has closed to new applications as of 31 March 2021 with a commitment to honour all vouchers and applications in the system as of that date.

The expected outturn for FT20/21 is circa £36m. There is an onward commitment to manage the remaining applications and vouchers in the system within a budget of £320m for FY21/22.";£468.66;The projects Baseline Whole Life Cost is £468.66m. This is primarily due to the following factors: Due to the early closure of the scheme to new applications, the whole life cost of the project has reduced to reflect the reduced scope.
2021;BEIS_0008_2021-Q3;Sellafield Product and Residue Store Retreatment Plant;BEIS;Infrastructure and Construction;To provide a facility that will receive special nuclear material from existing stores on the Sellafield site and process into a form suitable for safe and secure storage until 2120.;Amber/red;"The Infrastructure Project Authority's Delivery Confidence Assessment rating is Amber/red.This is primarily due to the following factors: This is a complex, ""first of a kind"" nuclear project, and as such has a high degree of delivery risk. Full Business Case (FBC) progressing towards HMG approval in Q1 2021. The Full Business Case (FBC) is based on the Major Project Baseline developed with Programme & Project Partners (PPP) and a matured view of the project scope and market informed cost and schedule information. Pending FBC approval the project performance continues to be reported against the Outline Business Case (OBC) approved in 2017. Delivery of the project has been affected by Covid-19 since March 2020 with significant efforts ongoing to minimise impact on overall cost and schedule. This report only includes COVID impact up to June 2021, and there is evidence that Lockdown 3 has indeed caused efficiency losses in design completion by limited attendance in the office.  Site construction has remained 'resilient' due to the robust COVID measures and management put in place; which enabled the progress of the main civil works, with completion of the main slab to the revised COVID impacted plan.";2012-03-01;2026-11-02;The project end-date is 02 November 2026. This is primarily due to the following factors: The  project end date reflected in the Outline Business Case, 02 November 2026.  The Full Business Case (FBC) baseline is finalised, and the Programme and Project Partners Major Project Baseline have set in the project completion date of February 2029. The FBC is currently going through NDA & HMG approvals (forecast June 2021 vs planned September 2021).;£86.24;£64.28;The budget variance exceeds 5%. The Full Business Case (FBC)  baseline is finalised, and the Programme and Project Partners (PPP) Major Project Baseline have been set. This will result in a revised budget for Financial Year 2020/21 of £61m,  the SRP project have reprofiled scope as part of their revised delivery strategy, this includes in the impact of COVID-19 up until the end of June 2021.  The will result in a variance less than 5%.;£763.98;The projects Baseline Whole Life Cost is £763.98m. This is primarily due to the following factors: The whole lifetime cost is based on the last approved Outline Business Case.  The forecast information in this submission is based around the Full Business Case (FBC) progressing towards HMG approval in Q1 2021. The FBC is based on the Major Project Baseline developed with Programme and Project Partners  and a matured view of the project scope and market informed cost and schedule information. The project FBC has undergone extensive assurance during its development. The FBC baseline gives a project completion date of February.
2021;BEIS_0007_2021-Q3;Replacement Analytical Project;BEIS;Infrastructure and Construction;The Replacement Analytical Project is a key component of the Analytical Services Programme, which provides essential services to operations on the Sellafield Site supporting 22 Programmes & approximately 200 Operational Facilities.  The existing facility is 60 years old and cannot provide long-term capability so new analytical facilities need to be established. The Replacement Analytical Project has therefore been initiated to deliver future analytical capability to the Sellafield site, through a major modification of the National Nuclear Laboratory Central Laboratory.  Key modifications are provision of standalone Highly Active (HA), Medium Active (MA) and Special Nuclear Material (SNM) analytical capability.  A key part of the scope is the delivery of 135 Analytical Instruments which will perform the ongoing analysis required by facilities at Sellafield.  Analytical Services remains essential to the delivery of high hazard reduction and remediation until the completion of the Sellafield Ltd mission.;Amber;"The Infrastructure Project Authority's Delivery Confidence Assessment rating is Amber.This is primarily due to the following factors: The project is made up of a number of workstreams the last of which is due to complete the preliminary design phase in July 21. The delivery of the detailed design will take until Jan 24 and then the Full Business Case will be produced and submitted.
The project has had design slippage in the current phase and is forecasting slippage of the detailed design. This is due mainly to COVID and the late placement of contracts to support the development of the analytical equipment and also partly due to performance issues. Given the early maturity of the project in the preliminary design phase and typically for projects at this stage, the lifetime schedule for future phases is not underpinned and is likely to change as the project matures. Importantly the project has a strategic tolerance to support completion of analytical services in the existing facility by Dec 2030.";2016-09-26;2028-07-10;The project end-date is 10 July 2028. This is primarily due to the following factors: The baseline end date is 10th July 2028.  However,  the Latest forecast of 9th Nov 2028 for completion of project support to active commissioning reflects a 4 month slippage from the Outline Business Case and baseline date, with the significant factors being the impact of COVID and supply chain contract delays.  Given the early maturity of the project in the preliminary design phase and typically for projects at this stage, the lifetime schedule for future phases is not underpinned and is likely to change as the project matures.;£36.19;£28.69;"The budget variance exceeds 5%. The budget of £36.19m represents the planned scope to be delivered against the plan put in place in 2019, which compares to a forecast of actual scope to be delivered at £24.23m, at a cost of £28.69m.  The project has delivered less scope than originally planned due to the multiple impacts of COVID19;  design deliverables delayed due to revised working arrangements and restrictions, limited site access throughout the year causing delays to early construction enabling works and delays placing supply chain contracts with staff being furloughed.  The actual scope delivered has cost more than planned primarily due to the impact of COVID 19 resulting in reduced productivity and inefficient working.";£643.54;The projects Baseline Whole Life Cost is £643.54m. This is primarily due to the following factors: The current baseline of £643.54m reflects the P50 (a probability of 50% to deliver for the cost) cost profile in the Outline Business Case, escalated into 2020/21 money values and incorporating the cumulative positive cost variance up to 2018/19. Given the relative immaturity of the project the P80 (a probability of 80% to deliver for the cost)  is £800M and the upper range is £1Bn from the Outline Business Case in 2019/20 money values (P80 escalated is £878m).
