year;project_number;project_name;department;report_category;description_aims;colour_rating;rating_comment;start_date;end_date;schedule_comment;total_baseline;yearly_forecast;variance_comment;wlc_baseline_incl_NCG;budget_comment
2021;NCA_0001_1415-Q2;NCA Transformation Portfolio;NCA;Government Transformation and Service Delivery;The NCA's Transformation Programme will deliver the culture, capability and capacity to enable the NCA to be a world-class law enforcement agency, leading the work to cut serious and organised crime.;Amber;"Compared to financial year 19/20-Q2, the Infrastructure Project Authority's Delivery Confidence Assessment rating remained at Amber. This is primarily due to the following factors: The NCA Transformation Portfolio continues to be tightly controlled against the annual Portfolio and Illicit Finance business cases which provide its justification and funding.  The primary control mechanism is the ongoing assurance of alignment to the Agency's Strategic Change Roadmap.  
This year the Agency has expended significant time and effort in maturing its management and control of portfolio scope, benefits, funding, risk and dependencies. The agency recognises key risks to funding and technology dependencies in 21/22 and future years.";2014-04-01;2022-03-31;"Compared to financial year 19/20-Q2, the project's end-date remained scheduled to finish on 31 March  2022  . This is primarily due to the following factors: Since the Q2 1920 (30th September 2019) baseline project end date of 31/03/22, the following primary project actions have impacted the original Q4 baseline project end date;
 - Effective controls have been introduced to help monitor timescales for delivery such as the staged funding approach and better rigour on programme business cases developed. Work has also progressed significantly to map dependencies with the Strategic Change Roadmap and prioritise projects which are critical for the organisation.
 - The Agency has also commenced Business Planning activities and prioritised critical programmes and projects that will receive funding this FY 21/22 with the Portfolio budget now tightly controlled.";£507.75;£503.70;The budget variance is less than or equal to 5%. The forecast is lower than budget by c£4m as it  removes optimism bias, offset in part by an increase to the core portfolio RDEL position (through NCA reallocating some budget to manage some priority demand pressures in Change Portfolio). the variance also reflects NCA securing additional funding to bring forward critical lifecycle investment into the 2020/21 financial year.;£6,457.40;Compared to financial year 19/20-Q2, the projects Baseline Whole Life Cost increased from £306.80m to £6457.40m. This is primarily due to the following factors: The Whole Life Costs have increased from last year due mainly to the extension of the time period covered in the 2020/21 return (one additional year). The current year return projects costs for a ten year period from the current year, to 2029/30. the 19/20 Q2 return, the time period covered by investment figures stopped in 2027/28. The SRO and Portfolio Director have reviewed the Whole Life Cost reported in this document and recognised that the value is overstated. It will be restating it in 21/22.
2021;ONS_0002_1112-Q1;Census & Data Collection Transformation Programme;ONS;Government Transformation and Service Delivery;Delivering a successful 2021 Census, researching how to make it the last of its kind and transforming the work of ONS in how we collect, process, and analyse data.;Amber;"Compared to financial year 19/20-Q2, the Infrastructure Project Authority's Delivery Confidence Assessment rating remained at Amber. This is primarily due to the following factors: The programme has delivered the capability required for the main 2021 Census collection.  Teams continue to work in a flexible way to meet challenges to the Collection operation activity which will continue until autumn 2021.  The pre-processing operation is now up and running and build for statistical processing and outputs is well under way. We remain on track to deliver a successful census.

The wider transformation continues at pace, with population statistics transformation operating in parallel with Census, on track for building to the 2023 recommendation. Social survey and business statistics transformation also continue to make progress and with most build on census now complete resources are now able to be re-focussed.";2015-01-01;2025-03-31;"Compared to financial year 19/20-Q2, the project's end-date remained scheduled to finish on 31 March  2025  . This is primarily due to the following factors: The Business Case for the programme was refreshed in August 2020.  There has been no change to the project end date. 

Benefits from the 2021 Census and wider Data Collection transformation remain on track for delivery by the agreed dates.

The Programme has an end date of 31 March 2025 marking the delivery of the final milestone relating to the assessment of the benefits of the 2021 Census.  The delivery of this will enable the Programme to fully close.";£268.30;£260.71;The budget variance is less than or equal to 5%. ;£906.00;Compared to financial year 19/20-Q2, the projects Baseline Whole Life Cost increased from £905.59m to £906.00m. This is primarily due to the following factors: The Full Business Case refresh was completed in September 2020 and the Budgeted Whole Life Costs have remained at £906m to the nearest million.  The increase from £905.59m is in order to re-align with the original HM Treasury approval of £906m - there is no change to the overall funding position or projected costs.
2021;ONS_0003_2021-Q4;Integrated Data Programme;ONS;Government Transformation and Service Delivery;The Integrated Data Programme (IDP) aims to build a comprehensive data service, underpinned by a secure and trusted infrastructure, to enable Government to make best use of its own data assets.;Amber;"The Infrastructure Project Authority's Delivery Confidence Assessment rating is Amber.This is primarily due to the following factors: The IPA Gateway 3 Delivery Confidence Assessment was  Amber
 
The review identified four areas where additional activity, or specific focus from the leadership team, are necessary to ensure success, specifically:  increased cross-Whitehall engagement and buy-in; stakeholder understanding of  how benefits will be measured; early progressing of Platform supplier engagements; and clarity around proposals for Data Virtualisation.";2020-01-01;2025-03-31;The project end-date is 31 March 2025. This is primarily due to the following factors: The FBC proposed a phased approach to delivery, with functionality delivered and benefits released, year on year, and with full capability delivered by 31/03/2025.;£20.00;£15.50;The budget variance exceeds 5%. The design and scope of IDP have been developed significantly since OBC, with input from stakeholders across Government, and some spend (primarily on staff) has been deferred, to ensure the right skill and capacity profile is recruited.  This resulted in an underspend in the last year, but helped ensure that the programme is well placed to deliver the ambition set out in the FBC;£377.00;The projects Baseline Whole Life Cost is £377.00m. This is primarily due to the following factors: The total gross whole life cost of the programme, based on the recommended scope is £377m.  This cost incorporates the resource to develop and maintain the platform, data activity, analytic capability and service wrapper.
2021;DEFRA_0007_2021-Q1;Science Capability in Animal Health Programme;DEFRA;Infrastructure and Construction;The SCAH Programme sets out the Department for Environment, Food and Rural Affairs' (Defra's) plans for long-term investment in the Government's main animal health science facility. The re-development of the site infrastructure and associated transformation programme will secure and safeguard the critical animal health science capability, protecting the nation from the impacts of animal diseases in a cost effective way.;Amber/red;The Infrastructure Project Authority's Delivery Confidence Assessment rating is Amber/red.This is primarily due to the following factors: Delivery Confidence is Amber-Red due to the likelihood of Programme cost exceeding its March 2020 budget allocation following development of more detailed plans for the new Science Hub. A new Programme Business Case, informed by a more comprehensive view of the change requirement, will form the basis for a re-baseline of cost, benefits and schedule. IPA validated this as a credible pathway to Green in December 2020.;2018-02-05;2029-06-30;The project end-date is 30 June 2029. This is primarily due to the following factors: A new schedule for the Programme Business Case will be informed by a more detailed understanding of the scheme requirements.;£38.00;£15.70;The budget variance exceeds 5%. The programme budget is expected to be in variance to the Outline Business Case baseline over its lifetime, which formed the basis of the Budget 2020 allocation.;£1,509.00;The projects Baseline Whole Life Cost is £1508.99m. This is primarily due to the following factors: The Project Whole Life costs is being updated and re-baselined as part of the Programme Business Case.
2021;DEFRA_0008_2021-Q1;Future Farming and Countryside Programme;DEFRA;Government Transformation and Service Delivery;By 2028, the Future Farming and Countryside Programme aims to deliver: 1) A renewed agricultural sector, producing healthy food for consumption at home and abroad, where farms can be profitable and economically sustainable without subsidy 2) Farming and the countryside contributing significantly to environmental goals including addressing climate change;Amber;The Infrastructure Project Authority's Delivery Confidence Assessment rating is Amber.This is primarily due to the following factors: The Future Farming and Countryside Programme's Delivery Confidence Assessment remains Amber in line with the IPA Programme Assessment Review in August 2020.  The Programme has effectively responded to the recommendations from this Review and the Major Projects Review Group conditions, as set out in August/September 2020 respectively, and continues to increase delivery confidence. With active reprioritisation to mitigate the effects of ongoing Covid19 lockdown  impacts the Programme has successfully maintained progress against critical path delivery.  In November 2020, 'The Path to Sustainable Farming: An Agricultural Transition Plan', was published, setting out the vision for the future. Since then, the Programme has launched a pilot of the first of three environmental land management schemes, the Sustainable Farming Incentive, which is the first step on the road to truly sustainable farming.;2017-05-01;2028-12-31;"The project end-date is 31 December 2028. This is primarily due to the following factors: We are embarking on these ambitious and much needed reforms amid an uncertain wider economic and policy context for the agricultural sector, as we discuss new trade deals and develop policy around net zero. 
This presents challenges we will have to navigate carefully. We are taking a co-design, test and learn approach which means we will monitor how the programme is landing and adjust course as needed.";£2,701.09;£2,731.22;The budget variance is less than or equal to 5%. ;£24,629.59;"The projects Baseline Whole Life Cost is £24629.59m. This is primarily due to the following factors: Costs are split into two main sections, the projected payment streams to beneficiaries (scheme costs), as well as estimating the associated future delivery, programme support and one-off implementation costs to deliver the Future Farming & Countryside programme (administrative costs).

Scheme costs are linked to the quantification of the manifesto commitment to guarantee the current annual budget to farmers in every year of this Parliament. This includes Non-Gov costs in relation to EU funding that will still be accessible under the terms of the Withdrawal Agreement, which will be available during 20/21, 21/22 and 22/23.

Administrative costs are made up of scheme running costs, corporate service charges, depreciation charges, programme support costs and implementation costs."
2021;DEFRA_0009_2021-Q3;Bridgwater Barrier;DEFRA;Infrastructure and Construction;The Environment Agency are working in partnership with Sedgemoor District Council to deliver this project located on the Parrett Estuary at Bridgwater, Somerset.  The project will provide protection from tidal flooding to the town of Bridgwater and villages downstream.;Amber/Green;The Infrastructure Project Authority's Delivery Confidence Assessment rating is Amber/Green.This is primarily due to the following factors: The outline business case has been approved by Defra Investment Committee and will shortly be submitted for HM Treasury approval. We await a decision from Defra on determination of the Transport an Works Act Order application (legal powers to construct);2014-03-01;2030-12-31;The project end-date is 31 December 2030. This is primarily due to the following factors: Project delivery within cost and programme forecasts. The key risk of the potential need for a Public Inquiry was mitigated by the ministerial decision to use the Written Representation process.  As a result, successful delivery of the project on time, agreed spend and quality appears achievable and there are no major outstanding issues that at this stage appear to threaten delivery significantly;£0.96;£0.96;The budget variance is less than or equal to 5%. ;£211.08;The projects Baseline Whole Life Cost is £211.08m. This is primarily due to the following factors: The Whole Life cash cost over the 100 year assessment period is £211m
2021;DEFRA_0010_2021-Q3;Leeds Phase 2 Flood Scheme;DEFRA;Infrastructure and Construction;LFAS2 will reduce the risk of flooding across Leeds using a catchment wide approach. The aim of the scheme is to deliver a 1 in 200 year level of protection (plus climate change allowance) through the use of linear flood defences, a large flood storage area and a flagship programme of Natural Flood Management measures. The scheme will help stimulate economic growth and regeneration within the city as well as responding to help address the current Climate Emergency.;Amber;The Infrastructure Project Authority's Delivery Confidence Assessment rating is Amber.This is primarily due to the following factors: This is the first annual return for LFAS2 . The project is rated as amber on the basis the project is progressing well - tasks outlined last quarter such as finalising a land purchase and the submission of Step 2 planning documents have both been achieved. Design and construction works are approximately 30% of the way through the programme and stakeholders continue to be engaged via dedicated recourses in the project team. Therefore over the course of the year risks on the project have decreased and the project end date remains unchanged.;2016-09-01;2024-10-18;The project end-date is 18 October 2024. This is primarily due to the following factors: The project is progressing well with 30% of design and construction complete. The project end date remains unchanged;£24.83;£14.00;"The budget variance exceeds 5%. The cashflow shows expenditure slipping into future years, albeit that the forecast outturn position for the project remains unchanged. 
The reasons for cost slippage is the focus on up-front design activities and discharging planning conditions. In addition, the effects of the coronavirus pandemic have also contributed to the expenditure slippage.  
It should be noted that the overall programme remains unchanged as we have used float and time risk allowances on these activities.";£146.37;The projects Baseline Whole Life Cost is £146.37m. This is primarily due to the following factors: There is no change to the baseline WLC. Delivery costs are based on well-established spend to dare and tendered costs. Future operation and maintenance costs are based upon standard estimates of assets being constructed and flood risk.
2021;DEFRA_0011_2021-Q3;Oxford Flood Alleviation Scheme;DEFRA;Infrastructure and Construction;"We are working with 9 partners on a major new flood scheme for Oxford, which will reduce flood risk to homes, businesses, and major transport routes into the city. Our scheme will provide a long term solution to flooding in Oxford, helping protect the city as flood risk increases with climate change.

The scheme will run through the existing floodplain west of Oxford. It will be formed of a new stream surrounded by a gently sloping floodplain of new wetland habitat and grazing meadow to create more space for water away from built-up areas.";Amber;The Infrastructure Project Authority's Delivery Confidence Assessment rating is Amber.This is primarily due to the following factors: We have confidence in the delivery of Oxford Flood Alleviation Scheme with respect to the design, quality and ability to meet our current programme. The scheme is fully funded and we have confidence that this will remain to be the case for our Full Business Case. We are carefully managing and monitoring the risk that our programme could move due to external factors.  We are working closely with Oxfordshire County Council to mitigate this risk.;2014-04-02;2030-01-09;The project end-date is 09 January 2030. This is primarily due to the following factors: Project delivery is within cost and programme forecasts.;£2.94;£2.24;The budget variance exceeds 5%. In the last financial year the scheme has undergone significant change brought about by external challenges that have led to re-design of certain elements of the scheme and withdrawal of our Compulsory Purchase Order and planning application. This has resulted in a longer programme, pushing out planning approval and construction completion. This has changed our expenditure needs, reducing contractor costs significantly, as well as consultants and our internal staff.;£204.83;"The projects Baseline Whole Life Cost is £204.83m. This is primarily due to the following factors: The whole life cost for the Oxford Flood Alleviation Scheme, considers all the work needed before, during and after scheme construction. This includes the cost of the work needed to design the scheme; gain the necessary planning approvals; purchase the required land and obtain business case approvals. It also considers the cost of materials and labour to construct the scheme, allowing for inflation and contingency for any risks which could occur and impact the delivery programme or cost. It also further includes the estimated cost of works needed to maintain the scheme over a 100 year period to ensure that it can operate at full capacity as a flood alleviation scheme and ensure benefit delivery."
2021;DEFRA_0012_2021-Q3;River Thames Scheme;DEFRA;Infrastructure and Construction;"The River Thames Scheme has 5 main objectives.  In preparation for the next phase of work we will be refining these objectives with our main partner to make them more specific. The scheme will reduce flood risk to people and property as much as can be economically justified within the constraints of affordability; Increase flood resilience and conditions that stimulate economic growth; Protect and enhance the natural environment and landscape: Enhance recreational opportunities, and; Maximise partnership funding contributions and demonstrate value for money";Amber/Green;The Infrastructure Project Authority's Delivery Confidence Assessment rating is Amber/Green.This is primarily due to the following factors: The scheme is fully funded and the Environment Agency will be delivering the project in partnership with Surrey County Council. A very thorough understanding of project risk is being actively managed.;2017-04-12;2029-04-12;The project end-date is 12 April 2029. This is primarily due to the following factors: The project is within delivery timescales and objectives forecast.;£4.51;£4.55;The budget variance is less than or equal to 5%. ;£308.48;The projects Baseline Whole Life Cost is £308.48m. This is primarily due to the following factors: The whole life cost provides for the cost to design, build and maintain the scheme (including estimates for inflation, risk and optimism bias) to ensure the calculated benefits are delivered.
2021;DEFRA_0013_2021-Q4;Nature for Climate Fund;DEFRA;Infrastructure and Construction;The Nature for Climate Fund Programme has been established to significantly increase tree planting, woodland creation and management, and peatland restoration, in England to support the delivery of Net Zero and 25-Year Environment Plan commitments. The programme is also designed to deliver wider social, economic and environmental benefits.;Amber/red;The Infrastructure Project Authority's Delivery Confidence Assessment rating is Amber/red.This is primarily due to the following factors: The Nature for Climate Fund was established in 2020/21. Significant progress has been made to establish the programme in 2020/21 and to start delivery against the programme's ambitious objectives. The programme has accepted all recommendations that were made by the IPA following reviews in the second half of 2020 and made significant progress in addressing these recommendations. This has included ensuring that the programme has the correct resources, capabilities and governance in place to support effective delivery.;2020-04-01;2025-03-31;The project end-date is 31 March 2025. This is primarily due to the following factors: The schedule of the programme positions the Nature for Climate Fund programme well for delivery against its ambitious targets. Delivery has already successfully begun in 2020/21 (year 1 of the programme) and 2020/21 has also seen significant work to establish programme structures that will support successful delivery in years 2-5, with significant ramping up of delivery from year 2 onwards.;£52.72;£52.72;The budget variance is less than or equal to 5%. ;£756.36;The projects Baseline Whole Life Cost is £756.36m. This is primarily due to the following factors: £640M of expected capital funding for the Nature for Climate Fund was announced as part of the Budget in March 2020. Only the 2021-22 financial year was scored at the 2020 Spending Review meaning future years funding is subject to approval through subsequent Spending Reviews.
2021;DEFRA_0014_2021-Q4;NO2 Reduction;DEFRA & DFT;Infrastructure and Construction;"The NO2 reduction programme is a joint programme with Department for Transport to deliver Nitrogen Dioxide (NO2) levels within legal limits in the shortest time possible. 
The NO2 reduction programme aims to deliver the 2017 UK plan for tackling roadside nitrogen dioxide concentrations and contributes to the Government ambition for a better environment and cleaner air.";Legal sensitivity around this programme along with the impacts of COVID-19 re-prioritisation prevented the IPA from providing a complete and independent assessment.;Legal sensitivity around this programme along with the impacts of COVID-19 re-prioritisation prevented the IPA from providing a complete and independent assessment.;2016-01-01;2027-12-31;The project end-date is 31 December 2027. This is primarily due to the following factors: The development of NO2 reduction plans in 2020 was impacted by COVID-19 and a number of local authorities have revised their schedules as a result. The first Clean Air Zone in Bath launched on 15 March 2021. The NO2 programme is legally mandated to deliver compliance with NO2 legal limits in the shortest time possible. The programme team works very closely with local authorities who have exceedances across England to develop and implement NO2 reduction plans.;£289.00;£151.50;The budget variance exceeds 5%. The NO2 programme is supporting Local Authorities to develop and implement measures to address NO2 roadside exceedances. Funding has been provided to Local Authorities to deliver the necessary reductions to tackle NO2 over the lifetime of the project. Due to COVID-19 there have been delays to local authority spending, resulting in an underspend.;£880.00;The projects Baseline Whole Life Cost is £880.00m. This is primarily due to the following factors: Programme costs relate to the development of NO2 reduction plans by local authorities who have exceedances, implementation of NO2 reduction plans, project costs for the central Clean Air Zone service, and modelling, monitoring and evaluation.
