",The project is currently on schedule.,The project end date reported above is a forecast based on suppliers' latest transition plans and project closure activities. The SMI is currently on schedule to complete its transition by end-April 2015. For the DI this is currently scheduled to be completed by end-July but its plan is in the process of being re-baselined as at the publication date for this return.  ,The project went live on 1st April as planned.,The project is currently on schedule.,Data not provided by department,Data not provided by department,Data not provided by department,Data not provided by department,Data not provided by department,Data not provided by department,Data not provided by department,Data not provided by department,In October 2013 the Treasury announced the Chancellor’s decision to extend the timing of the closure of the Scheme to 2015. The emphasis on delivering payments remains unchanged and  everything has been done to maintain the momentum to deliver as many payments as possible before the Scheme closes.  The Treasury has been working with NS&I to revise the programme milestones in the light of the extension.  ," A key dependency, the NGSS ISSC2 programme is experiencing some slippage.  This may impact on the HO go-live date (currently July 2015) but is not expected to affect the programme end date.",,"The Programme is undertaking an important period of analysis which will define the vision, objectives and business requirements and drive the programme plan and delivery.","The project has experienced delay as a result of infrastructure re-procurement: however, a revised schedule baseline has been established.","The first contract award remains on target for July 2015, subject to timely approvals following the general election.",Project ran to agreed schedule.,The programme is on track but with limited contingency in the schedule.,Data not provided by department,The programme is on track to deliver within the contractual run off period.,The Programme is currently working towards a revised Entry into Operation date of 30th March 2015. ,Project end date was the end of December 14 as a consequence of the delay to completing the OGC gate 5 review.,"The forecast end of the programme remains unchanged. Airbus Defence and Space was unable to provide an aircraft that passed the exacting acceptance criteria on schedule to meet the Programme's Capability Milestone 1 (delivery of first aircraft).  This resulted in the Transfer of Title being delayed from September 2014 to November 2014. The aircraft flew to RAF Brize Norton on 17 November 2014 and completed its first training sortie the following day. January 2015 saw Airbus Defence and Space advise OCCAR of a likely revised delivery schedule; this was published formally in February 2015.  The resultant delay to UK A400M aircraft delivery will prevent UK achieving Capability Milestone 2, UK In Service Date (ISD) (planned for March 2015) until September 2015.  The impact of these aircraft delays on subsequent UK milestones can be contained within the revised delivery plan, albeit at increased Programme risk, due to UK Programme Board action to prioritise the builds up of frontline capacity, whilst demanding more efficiency from the UK-specific A400M Defensive Aids modification programme, which is running in parallel with aircraft deliveries.

",AIRSEEKER has delivered an early beneficial use in direct support to operations ahead of the approved Initial Operating Capability (IOC) declaration. Considerable progress against the IOC Programme of Record has been achieved.    The Programme's focus is now on the planned schedule working towards Full Operating Capability in 2017.,"On Schedule.  The structural changes to be implemented as part of the first phase of the Programme are on track, with the main changes due to complete in accordance with the plan during 2015.  The Army 2020 Team is now working to complete the detailed implementation plan for the second and final phase of the Programme, which entails Transformation of the Army so that it is able to deliver its required outputs within reduced resource levels.  This too remains on track.  

","In 2014 the Army Basing Programme (ABP) has seen 30 Units move and/or re-role in the UK, plus one unit move from Germany to the UK, in line with plans.  This has created the conditions for troops to  return from Germany in 2015 to deliver the  Strategic Defence and Security Review promise of 50% of troops out of Germany by 2015. Of those units planning to move in 2015 there are a small number for whom the necessary end-state infrastructure will not be available in the declared timeframe, and work is ongoing to further understand the implications and identify solutions. As of now MOD remains on track to deliver the announced closure of garrisons in Germany in addition to the return of all Army personnel from Germany to the UK by 2020.","The Project remains on schedule to deliver the remaining 5 submarines within the latest approval, although some substantial risks and challenges remain. The first two submarines have been handed over to the Royal Navy and the third was launched in May 2014."," The delivery of living and working accommodation at Stafford for the two Signal Regiments relocating from Germany is on schedule, and in some cases, ahead of schedule. We have a detailed movements plan that will see the units relocate in Summer 2015 enabling us to close Elmpt and Herford Stations in Germany and hand them back to the German Federal authorities by the end of this calendar year.","No change to end date since last year. The Red/Amber RAG status at 2014/15 Q2 reflected the major risks and issues which were apparent in a number of areas such as delivery schedules and support solutions which will require additional maturity.  Progress is closely monitored and reported through CEPP governance processes.  The objectives issued by the Senior Responsible Owner (SRO) are the route to improving the delivery confidence and keeping the programme on schedule, by promptly resolving the risks and issues. This appears feasible at this stage.","Project NEW BUY Initial Operating Capability was achieved on 31 Jan 15, while Project JULIUS Full Operating Capability was declared over 6 months early on 22 Apr 15. The remaining NEW BUY aircraft remain on schedule to be delivered by 31 Dec 15, with the last JULIUS aircraft delivered by 31 Dec 16.","Complex Weapons is a pipeline, which means that the current end date will change in line with the inclusion of new projects within the pipeline construct. ","The requirement to refuel HMS Vanguard, with the option to refuel HMS Victorious, is an extension to the scope approved at Main Gate, and the consequential impact upon CPC is a five year deferment to the approved FOC date (May 2021). This deferment allows the manufacturing of cores for Astute and Successor boat 1 in parallel facilities. The project delivery team and Rolls-Royce continue to investigate potential opportunities to improve the programme's resilience. Phase 1 of regeneration continues to make good progress with the construction and fitting-out of buildings, and purchase and trials of equipment. Completion of phase 1 is currently forecasted to be March 2017. ",Strategic schedule remains intact.,The Department has accelerated the CROWSNEST Programme and downselect was achieved in April 2015.,Exempt under section 26 of the Freedom of Information Act (2000),"The projects need to deliver new services at the point where the legacy contracts expire.  In 2015, DII and DFTS successor contracts will be placed and the Future Application Hosting Environment will achieve initial operating capability.  These are key elements of the Infrastructure, Networks and Applications programmes.  The other key elements of these programmes remain in concept phase.   ",Schedule being accelerated to achieve maximum benefits available.,The Programme remains on schedule to realise its benefits,"The programme is on track to deliver, with Command Implementation Plans being endorsed as planned, or on track to be endorsed.",The Programme remains on track to deliver the UK IOC in December 2018 and subsequently IOC (Maritime) and FOC. The UK's first Lightning II Squadron is in place at Edwards Air Force Base in California and has taken delivery of its first aircraft. Some risk to the schedule remains as the Air System is still in the System Design and Development phase.  Work since 2014/15 Q2 within the programme has identified a more suitable end date of 2026 by which time FOC and the current weapon programme will have been delivered.,No change. The Business Case was approved by the MOD's Investment Appraisal Committee and the Defence Board in January 2015.,"MARS Tanker project remains on track, with cut Steel and Keel lay Milestones for the first ship was achieved in June and December 2014, respectively, on time. Steel Cut Milestone for the second ship was achieved in December 2014.  HRAS has now been converted and handed over to Flag Officer Sea Training as the Future Replenishment At Sea Trainer (October 2014).",The MARSHALL Programme achieved Contract Award on 28 Oct 2014 and met its programme vesting day milestone of 1 Apr 2015. ,The Programme achieved its Initial operating capability (IOC) early in Jun 14.  The Programme is on schedule to deliver ahead of approved timescales.,"MCC no longer exists as a programme construct and the above start and end dates are no longer relevant.  However the two new disaggregated GMPP programmes end dates are scheduled as: Armoured Cavalry 2025.  The programme should be closed once full operating capability is reached – scheduled for Q1 2025; Armoured Infantry 2026 - The ABSV (as part of the programme) remains an aspiration at this stage but is likely to deliver vehicles on a schedule out to Q4 2026.  At this point, the Armoured Infantry Programme will have reached full operating capability and can be closed. Thus these two programmes will end well in advance of the 2033 date, stated against the previous MCC Programme, because the elongated timelines were applicable to programmes now out of scope of the Armoured Cavalry and Armoured Infantry programmes.","Tranche 1 In Service Date (ISD) took place in Q3 2014/15 and is now in Steady State running, NHP's ISD took place in Q3 14/15 and is now in Steady State.
Tranche 2 ISD is scheduled for Q4 14/15.  Regional Frameworks for Scotland - Successful Bidders letters issued Q3 2014/15. Regional Framework for South West and South East - Contract Award Q4 2015/16. NGEC Programme delay of one year was caused through a combination of delays to approvals, limited number of subject matter experts, the integration of a new Integrated Management System (IMS), the Enhanced Operating Model and the integration of other programmes into NGEC.",The NEM programme remains on track to deliver its agreed remit by 2021; the transition plans for pay reform and accommodation charging will have completed by then. Forces Help To Buy (FHTB) interest-free loan pilot was successfully launched in April 2014. The next milestone is harmonisation of Engagement Structures which will take effect from April 2015. Further change is anticipated in 2016 when a new pay model and accommodation charging system are planned to go-live.,Exempt under section 24 of the Freedom of Information Act (2000),The programme has achieved a number of key milestones in line with the baselined plan and future milestones are on track to be achieved. Release 1 system development completed on time and is in the process of being deployed into the business. Scoping for Release 2 is underway which will provide a firm delivery schedule for the next phase of the programme. ,"Close management of the remaining work, most notably the Release-to-Service approvals, continues to improve delivery confidence.  The programme achieved Initial Operating Capabilities five weeks ahead of schedule on 23 Feb 2015 and is on track to deliver Full Operating Capability on or before their target date.","Some of the Alliance Management Board's initiatives are starting to bite and strike rates are improving in areas.  This is encouraging and we look forward to tangible progress in adherence to schedule, although schedule risks remain.  We continue to work with the Alliance Management Board to mitigate this and to resolve areas critical to the capability of  HMS Queen Elizabeth.  Early indications of progress on Prince of Wales are that build quality is significantly improved and the current performance, cost and time remain on track.  ",The latest approval for SFU includes the full manufacture phase and the above project end date reflects the end of manufacture.,"The SBPIP in on schedule to date.  A recent MPA review has concluded that there are no remaining procurement issues to be addressed, and has recommended that work on incorporation is taken forward as a separate project. This project has now been established. The SBPIP can therefore now be closed.","The programme is on track with benefit identification and delivery underway. The signing of the Foundation Contracts has been achieved (Rolls-Royce in February 2013, BAES in July 2013 and Babcock's MSDF in September 2014).  With all Foundation Contracts signed, SEPP is preparing for the Graduation process from the Defence Major Programmes Portfolio which is scheduled for Spring 2015. ","The Successor assessment phase programme is currently on average three months behind schedule, but key milestones such as the Whole Boat Preliminary Design Review and power plant Critical Design Review have been achieved on time.","DE&S was established as a bespoke trading entity in April 2014. Managed Service Providers are under contract to support DE&S in developing plans to reach a ‘match fit’ end-state. The process of transformational change is to deliver a ‘match fit’ DE&S by April 2017.

","The programme is maintaining current delivery milestones. The known issues which were re-enforced in the July 2014 Project Assessment Review (PAR) precipitated Project Vector and a move to an incremental procurement strategy to bring realism to the programme and adjustment to some of the assumptions may occur over the next year.  These will become clear in late Spring/early Summer 2015 and will bound the Manufacturing Phase delivery assumptions.
","Typhoon Tranche 2 has been declared multi-role capable for air to ground operational missions; The next major milestone for Typhoon is on 31 Dec 18 when Typhoon Tranche 2 and 3 will declare a Stormshadow and Brimstone 2 capability  (the latter almost 2 years earlier than originally planned).  This will align delivery of key weapons with the Out of Service Date for Tornado GR4 and therefore ensure continuous delivery of key UK capability effects from combat aircraft.  Delivery of Tranche 3 aircraft is progressing on schedule.
","The Army (BRH) Initial Operating Capability (IOC) was declared in August 2014, within planned timescale. The Flight Simulators reached a limited standard to support early training and extraordinary management action continues to be applied to build incrementally to the full training system. The revised Mission Support System is due to start implementation in early 2015.  An additional maintenance contract has been let and aircraft availability has significantly improved and is no longer impacting aircrew training. The Navy (SCMR) IOC remains within its Time, Cost and Performance approval and is independent of the Future Anti-Surface Guided Weapon (FASGW) Programme.",The programme was re-baselined in June 2014. The first major milestone (Initial Operating Capability) was achieved by deploying the capability to Afghanistan in August 2014 at the Operational Capability Unit (OCU) standard. The next milestone is to generate additional capacity of 4 Task Lines (at the OCU standard) in April 2016.  The main effort is to achieve Full Operating Capability (FOC) Apr-Jul 17 with an uplift of the capability to Equipment Standard 2 (ES2). This will require a major Release to Service (RTS) amendment.  The programme remains on track to achieve these milestones.  Achieving programme milestones remains challenging but the re-balancing process has delivered a taut and achievable timeline. ,JAMES completed its rollout as planned in March 2014.  The current delivery Fleet Management and DRACAS are on track.  The requirement for additional CHE storage has changed into a requirement to re-locate and expand the existing storage.  A DIO Initial Gate Business Case (IGBC) for CHE storage will be presented in 2015 setting out the options for the way forward.,"In September 2014 the final court closure, Alton Magistrates’ Court, was completed. ","The programme is on track to deliver as planned:
• Rollout of digital solutions has already commenced,
• The Magistrates In Court Presentation solution is almost 50% complete,
• Wi-Fi installations are on track and national rollout has commenced.","The programme end date has now been re-forecast based on: 
• The new timetable for business case approval, 
• A better understanding of scope and implementation logistics, 
• Feedback from the market as to likely duration of development and deployment.
","The programme is performing well against all planned milestones. 

Of particular note is the successful uptake of eForms, which has been significantly higher than projected. 

The interface for automatic exchange of data between the case management systems at the LAA and HMCTS was implemented on 8th December 2014. It is currently being used by a small number of caseworkers in the Nottingham Criminal Applications Team and caseworkers have been able to take advantage of interdepartmental information sharing by obtaining more accurate data from a range of resources. 

The transfer of the London area was a very important milestone for the programme, due to the area's unique nature.  Throughout its transition the programme followed progress very closely and were able to identify specific issues and provide solutions to these. 

The programme has implemented an extensive engagement plan with providers, to explain the benefits of electronic working.","The programme end date was delayed due to the withdrawal from the competition, and subsequent audit, of the incumbent EM service suppliers.  This impacted decision making on the EM competition and contributed to a protracted preferred bidder phase as lessons were incorporated from the audit.  
",The FITS Programme is moving from its procurement phase into delivery in line with the approved plan.,There is no deviation from revised schedule. The project team is continually assessing the project delivery plan with the aim to pursue the most ambitious timeline. ,Funding has now been agreed and work has commenced on projects that underpin the delivery of the HMCTS Reform Programme. The  end date has now been finalised as 2020.,"Client and Cost Management System (CCMS) is the online system through which providers can submit civil legal aid applications. National rollout of voluntary usage of CCMS commenced on 31st March 2014 and was completed on 29th September.  Contractual Notices outlining the timeline to mandatory use of the system were issued to providers on 26th January 2015. This will mandate the use of CCMS for new legal aid applications from 1st October 2015. The 8 month lead in time is to provide firms with sufficient time to train their staff and integrate the system into their businesses. There has been a steady increase in usage with approximately two-thirds of providers using the system to process applications, equating to c.50% of applications being processed digitally.
The project end date has consequently been revised accordingly.","The programme completed in June 2013, but was retained on the MPA reporting pending an independent post implementation review. This was completed in October 2014 and the programme is now formally closed.","The introduction of the Residence Test for civil legal aid was delayed from 4 August 2014. The Government has appealed the Judicial Review judgment. 

All other reforms scheduled for implementation between December 2013 and July 2014 have been delivered. For example: 
• Restricting the scope of legal aid for prison law, 
• Reducing the use of multiple advocates, 
• Reduction in Expert Fees in Criminal and Civil Family Proceedings, 
• Imposing a financial eligibility threshold in the Crown Court, 
• Harmonising fees paid to self-employed barristers with those paid to other advocates appearing in civil (non-family) proceedings, 
• Court Bundles changes.

Prompted by the judgment in a legal challenge to the 2015 Crime Competition Duty Tender, the MoJ launched a consultation in September 2014 seeking evidence relating to specific technical aspects of the KPMG and Otterburn financial reports. The consultation closed on 15 October 2014. This has delayed the commencement of a competitive tender for crime contracts.","The Programme remains on schedule and continues to work to minimise risks to delivery.

Commercial negotiations with SSCL completed to schedule and a contract to outsource the relevant back office services is in place as of 1st November 2014. Negotiations were supported by Cabinet Office. 

Work is progressing on planning transition activities including arrangements for incumbent suppliers, whose services will continue to be required up to the transition to the ""Independent Shared Service Centre 2"" (ISSC 2) Standard Operating Platform in 2016. 

A project recommendation was approved in October 2014 to defer the migration of Finance data from the legacy system. This transfer was aligned to the end of the 14/15 financial year. This was due to technical issues around data extraction from the old platform ready for the new platform. The data assurance testing is now complete and User Acceptance Testing  (UAT) is now complete. Business readiness preparations are underway. 

The programme is due to exit Steady State and commence transformation. Some initial milestones have been missed as the transformation plan delayed but the programme is working closely with SSCL to bring the timetable back on track.","The project remains on schedule to deliver the first of 2,100 places in February 2017, with a phased rollout of further places throughout 2017.

Funding has been re-profiled to allow construction work to commence earlier.","Deployment of the main rollout activities was paused between August and December 2014, whilst significant performance issues were investigated and corrected. 

The revised remediation plan agreed by the Programme Board, sets out the new phased approach to delivery. This has had significant impact on the schedule, moving the main rollout and programme closure into 2015/16. 

However, some aspects of the programme (printer deployment and Satellite replacement) have now been completed.","The Programme completed all its deliverables in December 2013. Following the standard MPA approach to assess costs and benefits, sufficient time operating under a new contract must be allowed before formal project closure can be achieved. An independent assurance review to assess delivery of benefits was undertaken in Autumn 2014, enabling formal closure in early 2015.",The programme remains on track.  The Competing Delivery of Services contracts were awarded in November 2014 as per schedule.,"The programme delivered against key milestones, including:
• The transition to the new Community Rehabilitation Companies (CRC) and National Probation Service (NPS) structure on the 1st June,
• The launch of the CRC competition which generated significant levels of market interest from a broad and diverse set of bidders, 
• The award of contracts on 18th December 2014,
• Commencement of the under 12 month provisions for the Offender Rehabilitation Act.

The programme was successfully closed as planned in Mar 2015. All outstanding issues and actions were formally transferred to the business owners responsible for ongoing service delivery. Delivery of benefits against the business case will be tracked within the business areas.","The programme is delivering to schedule. 

In addition to the progress on procurements for improved services, four Regional Resettlement Consortia were launched in November 2014, alongside an innovative partnership with employers to provide work placement on-release (the Turnaround to Work initiative).

The programme is now focused on 
• Successful mobilisation of the new YOI Education Provision alongside wider improvements to the operation of YOIs ,
